id,text,sentiment_SVM_5
211,"Major Road Blocks Linger,But Driverless Cars Are Here to Stay http://t.co/CQfLSOxG4e  Cool,I hate driving #smallbiz #innovation",4
212,A driverless car invented by Google has completed over 300k miles and only had two accidents when humans in other cars hit it @caitcrider_x3,4
213,"I, for one, canÌ¢‰âÂ‰ã¢t wait for driverless carsÌ¢‰âÂå_ Ì¢‰âÂèÏcause you all drive fer shit.",4
214,"@edasneak with my amount of wrecks, I should be the first to have a driverless car haha. Ì¡ü‰Ûªå",3
215,Ì¢‰âÂÒ@Nextgov: Can driverless cars save the Postal Service? http://t.co/H3AlvVfFJNÌ¢‰âÂå great idea but that also relies on innovation from @usps...,4
216,"How Driverless Cars Could Reshape Cities, via @nytimes  I am ready for a driverless car. Bring it on! http://t.co/mZ9vpbaeiW",4
217,@Mobileye raises $400M to kick driverless car technology into high gear http://t.co/XvfUj27sB8 turning morning commute into nap time?,4
218,Rather exciting. RT @stianwestlake: More on how driverless cars will reshape cities: http://t.co/YPFh6Ai3f4,4
219,"How Driverless Cars Could Reshape Cities, via @nytimes narrower streets, cleaner air #futurework http://t.co/evO9pYc8rT",4
220,"Recently, driverless #Google cars have been invading Sactown. So cool. Hopefully, Skynet isn't invading next. That would be less cool.",4
221,Driverless car #WantIt #NeedIt,4
222,Driverless cars? I feel like my childhood dream of owning a Autobot could transpire in my lifetime.,4
223,Entered my driverless Tesla through the passenger door. I like this whole not having to drive thing.,4
224,The coolness of driverless cars-90% of all car accidents involve human error (says Marco della Cava). Pretty exciting.,4
225,Google better hurry up with that driverless car. Watching grandma do an 8 point turn to get in a parking spot is horrific.,4
226,Google's own prototype driverless cars! http://t.co/Zl0McVQzN5,4
227,Why GoogleÌ¢‰âÂ‰ã¢s driverless cars change everything - http://t.co/VShua8XyjQ #Google #driverless #taxi,4
228,Just saw Google self-driving car on I-34. It was painted green and blue.,3
229,Will driverless cars eventually replace taxi drivers in cities?,3
230,"Driverless cars are now legal in Florida, California, and Michigan",3
231,Audi is the first carmaker to get a license from Nevada DMV to test automated vehicles. #audi #ces #cartech,3
232,Audi says first car manufacturer in the world to get a license from Nevada DMV to test autonomous vehicles (Google doesn't make cars) #CES,3
233,Audi to be first automaker in California to test self-driving car. @latimes @Audi  #Selfdrivingcars  http://t.co/WyScAlOQEF @,3
234,Ì¢‰âÂÒ@latimesautos: Audi gets first permit to test self-driving cars on California roads: http://t.co/L71qpM42lY http://t.co/CWBbOAwahLÌ¢‰âÂå Ì¡üèÏå_Ì¡üèÏå±,3
235,Audi Gets Permit to Test Self-Driving Cars in California http://t.co/JKDtJSUPwA,3
236,"Google, Audi, Mercedes get California's first self-driving car test permits: Cars without drivers may soon be... http://t.co/Mx9JX0rgXj",3
237,Audi Gets First Permit to Test Driverless Cars in California: Some Bay Area drag queens say they are... http://t.co/Bc5mlrrgEJ,3
238,"Today state regs for autonomous cars go into effect: Audi of America gets 1st permit to test driverless cars on public roads, per @CA_DMV.",3
239,Audi gets first permit to test self-driving cars in California: Think twice next time you tailgate that new Audi... http://t.co/JWTioM2nJT,3
240,Audi Gets First Permit to Test Driverless Cars in California: Some Bay Area drag queens say they are... http://t.co/YGoAqLEhUP,3
241,Audi Gets Permit to Test Self-Driving Cars in California http://t.co/V62MR5IaVN,3
242,"Ì¢‰âÂÒAudi becomes first automaker given permit to test self-driving cars. http://t.co/jNMKLEWrkT http://t.co/dqQ6NJfJlf"" @babydellz",3
243,Audi Snags First Permit To Test Self-Driving Cars In California: LOS ANGELES (CBS/AP) Ì¢‰âÂ‰Û Audi is the first... http://t.co/PrtyPZYBSE,3
244,Here we go! @Audi gets first permit to test self-driving cars on California roads http://t.co/XDcPbgMAXh http://t.co/Q0ouYVOPLK #tech #auto,3
245,AGV (Automated Guided Vehicle)  @ TraPac Dock http://t.co/E4xiHwSb,3
246,AGV (Automated Guided Vehicle)  @ TraPac Dock http://t.co/WCdgvwIj,3
247,AGV (Automated Guided Vehicle) @ TraPac Dock http://t.co/WCdgvwIj,3
248,At the SAE On-Road Automated Vehicle Standards Committee Open Meeting,3
249,Not possible for blind people to drive an automated vehicle that requires intervention during failure. Need L4 automation for that#AutoAuto,3
250,"Transportation becoming a service model? If OEMs are responsible for automated vehicle control, they might as well own it #AutoAuto",3
251,Automated vehicle vs connected vehicle #MITTRSummit http://t.co/5RqYp4eKb2,3
252,WO2013070799A1 Automated Vehicle Conveyance Apparatus Transportation System #B61B #B61B13 http://t.co/HToCWDVEZM,3
253,How is an automated vehicle supposed to behave in an emergency? #AutoAuto,3
254,"#ExperienceBosch My first ride on the automated vehicle is so surreal. Staring at the analysis, weÌ¢‰âÂå_ http://t.co/tCYqtoHMgE",3
255,"Chris Urmson, director of Self-Driving Cars at Google, speaking at Automated Vehicle Symposium 2014. http://t.co/YFWlfzM39Z",3
256,How is an automated vehicle supposed to behave in an emergency? #AutoAuto,3
257,"#AnnArbor is home to ongoing experiment w/ talking #cars? ""@freep: Automated vehicle test site groundbreaking today http://t.co/QwbtJbSBwy""",3
258,WO2012158248A1 Collaborative Vehicle Control Using Both Human Operator And Automated Controller ... #B60Q #B60Q1 http://t.co/Ku4mwYor,3
259,"Wow - ""@AUVSI: Google goes commercial: Company teams with Continental for automated vehicle systems... http://t.co/YHLH9Pq2Xa""",3
260,Blogged: Automated vehicles and the Motor Vehicle Code: http://t.co/P5ccubJ0,3
261,"California's new automated vehicle regulations (smartly) do not define the ""operator"" of automated vehicles. New term is ""designee.""",3
262,"Last year, Google warned it would have an automated vehicle  ""commercialized product in the not-too-distant future.""  http://t.co/aAmWYEWiMf",3
263,@ford video: sensors on Fusion Hybrid Automated Research Vehicle  https://t.co/ThUNZSk0qN,3
264,Here's the @Ford Fusion Automated Hybrid Research Vehicle. And those are light sensors on the roof: http://t.co/4d856CIdBl,3
265,"At #ITSWC14 in Detroit, GM announces new automated and connected vehicle technologies for 2017 Cadillac models: http://t.co/PIJOYkQfMZ",3
266,GM announces new automated and connected vehicle technologies for 2017 Cadillac models: adillacÌ¢‰âÂ‰ã¢s 2017 model year... http://t.co/KHRRFRQk2A,3
267,"Dematic Introduces Pallet Delivery Automated Guided Vehicle System Kit: GRAND RAPIDS Ì¢‰âÂ‰Û Dematic, a supplier of... http://t.co/T2o0RU9DUk",3
268,GM announces new automated and connected vehicle technologies for 2017 Cadillac models: adillacÌ¢‰âÂ‰ã¢s 2017 model year... http://t.co/JvlRiLWJGw,3
269,Fully automated vehicle enabled with #ibmcloud at #ibmpulse http://t.co/puLi6CAvL5,3
270,The Lexus automated research vehicle #ces #cartech http://t.co/UiO4hzyW,3
271,@Gizmodo yeah. The only reason to have an automated vehicle is so you can drink in it. #Duh,3
272,"#TreatsTrails rt""@SugarSpicePixie: Ì¢‰âÂÒLight in MotionÌ¢‰âÂå Car Ì¢‰âÂ‰ÛÏ Fully Automated Electric Vehicle http://t.co/Uc4T8pKn0f""",3
273,boarded for the Automated Vehicle Symposium 2014. use #autoauto for conference related tweets,3
274,Gearing up for the Automated Vehicle Symposium 2014. use #autoauto for conference related tweets,3
275,Will insurance markets be ready 4 shift to product vs personal liability? MT @WIRED: Nissan autonomous car by 2020 http://t.co/yeSTFiYcGv,3
276,"Google reportedly working on its own car, considering autonomous taxi service - http://t.co/AzRqsZLqIF",3
277,Autonomous car concept brings business class to the road http://t.co/Tq3Rwl7WIJ http://t.co/5m00LCkzV5,3
278,Autonomous car study: FL among first to embrace technology &amp; real business opportunities for state thanks to law by @JeffreyBrandes #sayfie,3
279,GM's Mark Reuss: we have been building and testing autonomous vehicles (think Google car) for 8 - 10 years with results in current cars,3
280,Morgan Stanley has finally put a precise date on the autonomous car utopia: http://t.co/EalTxI0c6T,3
281,"Rendell: I was gonna take Uber, but if an autonomous car is here it could drive me home. Ed, tell the PUC to clarify @Uber_Philly is legal!",3
282,Great update Ì¢‰âÂÒ@driverlesstrans: A good description of existing car #Autonomous functions by #SysConMedia. http://t.co/cEUuS4hFqvÌ¢‰âÂå,3
283,"Shelley, Stanford Autonomous Car at #StanfordConnects LA ! http://t.co/UTsblD0aq5",3
284,"Forget autonomous cars for the masses, just give people the technology to open a car door without singing the vehicle next to them.",3
285,Where's My Autonomous Car?  http://t.co/fGoScKqd by @bakercom1 #Google #driverlesscar,3
286,Waiting for lexus presser at #2013ces. Autonomous car tech hoping to make  @ Mandalay Bay Convention Center http://t.co/rz3BVt2t,3
287,Closer than previously expected: autonomous horizon. | NYTimes: Drivers With Hands Full Get a Backup: The Car http://t.co/UcBtdaUe,3
288,RT @peternowak Q&amp;A with Toyota executive about the new autonomous Lexus project. Just don't call it a robot car http://t.co/6ABTHRvT,3
289,Toyota showcased autonomous car tech at CES - http://t.co/2k8ghiRW,3
290,The autonomous automobile... Why the big car makers are letting #Tesla take the lead with self-driving cars. http://t.co/sKw5iKmhdn,3
291,MTÌ¢‰âÂÒ@ariyahidayat: Mercedes autonomous long-distance drive: will this give Google's car a run for its money? https://t.co/MxLpkevstL #Sayfie,3
292,#Java powered autonomous #car. http://t.co/wTaRujWPPY,3
293,#connected car tent. 4 unique perspectives on the #future of connected and autonomous cars @ SXSW 2014 http://t.co/58c7Jw3yfy,3
294,I just saw an autonomous car in Lake Charles. It was green. Does anyone know what company it might have been?,3
295,"one autonomous test car generates 300gb of camera data per hour // VW Chief: Ì¢‰âÂÒThe car must not become a data monster"" http://t.co/G2Wc7n5yth",3
296,Self driving autonomous car #innovationMOHA,3
297,Unique concept; not sure what to think. Autonomous car doubles as a room in your condo: http://t.co/mdwVC2Mo9h,3
298,"@SammyWalrusIV - please, whatÌ¢‰âÂ‰ã¢s an Ì¢‰âÂÒautonomousÌ¢‰âÂå car?",3
299,ITU &amp; GSMA need to accelerate std's before the kids hit road @conneally: ITU given keys to autonomous car standards http://t.co/FuJ0u8xIjyÌ¢‰âÂå,3
300,Autonomous cars + UberÌ¢‰âÂ‰ã¢s model = letting your car make you money while not using it. Will you even own a car if not for profit? #Future,3
301,"Meeting at the GM offices in Palo Alto, the segway autonomous car has only 2 wheels. [pic]: http://t.co/OaB73yeDSa",3
302,"Slowly and steadily the autonomous car will arrive, with the help of...automated driving aids. http://t.co/PUXhz5jIls",3
303,"@TheEconomist: Slowly and steadily the autonomous car will arrive, with the help of driving aids http://t.co/nhpXm42Dz6",3
304,"autonomous car accidents, are the easiest problem to solve thanks to cameras and no fault states via @MorganStanley #AutoForum",3
305,Safety mandates forecast to drive autonomous car sales: http://t.co/Fvur4wygtF @Automotive_News,3
306,"Hypermorgen Icons For The Near Future, From Printable Meat To Autonomous Car Warnings http://t.co/MbCFgrfLa7",3
307,The new @NissanUSA Murano offers more advances tech getting them closer to goal of autonomous car by 2020 #NYIAS,3
308,Self-driving car @ComputerHistory for autonomous vehicle exhibit opening 5/8 (it didn't drive itself inside) http://t.co/jJBzvaksQ8,3
309,"Come to think of it, looks like the first self-driving (autonomous) car was Toyota...",3
310,"The huge news this week in the auto industry is @GoogleAuto's self-driving, autonomous car: http://t.co/tIYBfAPM6I http://t.co/LxuX1oZP06",3
311,"Google unveils fully autonomous, hands-free car prototype [w/videos]  http://t.co/KrauTretw1",3
312,Human Factor 3: what if the autonomous car has a flat tire?,3
313,Human Factor 4: what if the autonomous car needs to merge with your friends in their autonomous cars?,3
314,The Car-Phone has evolved into the Phone-Car #autonomous #futurecar #driverless http://t.co/5lOTnBeqzl,3
315,"Nope, it's not a mapping car - it's an autonomous car. @ SLAC National Accelerator Laboratory http://t.co/O01LsXfIJn",3
316,"The huge news this week in the auto industry is @GoogleAuto's self-driving, autonomous car: http://t.co/5o7pPIyL9N http://t.co/nZVWwMb77S",3
317,Google unveils driver-less car...can you see yourself buying an autonomous car?http://t.co/CVRbr9kpcX,3
318,"#MITCIO John Leonard, mit autonomous car guru. Google: Combine sensors on car + knowledge of detailed knowledge of   context.",3
319,Google's announcement of their new self driving car arrived just in time for my debate on autonomous vehicles,3
320,Google unveils driver-less car...can you see yourself buying an autonomous car?http://t.co/k5MagOY990,3
321,"Whilst you may think an autonomous car may solve this, you'd be wrong. I'm terrible at naps once I've risen for the day.",3
322,Driver vs. Autonomous car: Who Wins? http://t.co/cNwFVXb1 #twitterpoll #article,3
323,What you and I as enthusiasts learn from #TUdetroit and the Google Car is that Autonomous Drive is closer than anyone's figured.,3
324,"#TUdetroit: Nissan's Dan Teeter, Director, Connected Services, goes from Connected Car to Autonomous Drive.",3
325,"#TUdetroit Teeter, @NissanUSA: Autonomous Drive Leaf is the first self-driving car to be plated in Japan; even demoed by the Prime Minister.",3
326,I wonder if GoogleÌ¢‰âÂ‰ã¢s autonomous car will include an Ì¢‰âÂèÏIÌ¢‰âÂ‰ã¢m feeling luckyÌ¢‰âÂ‰ã¢ button.,3
327,"Why can't you take the quad copter drone, make it bigger to carry 2 people and make it autonomous? it would be easier than self driving car.",3
328,"Would you buy an autonomous driving car? Excited, dubious or downright offended? http://t.co/yTWi2kkn9L",3
329,"#TUdetroit Teeter, @NissanUSA: Autonomous cars, just around the corner, could revolutionize the entire design of tomorrow's car.",3
330,"Autonomous cars in $10K. Ì¢‰âÂÒ@WIRED: This startup claims it can make any car autonomous for $10,000 http://t.co/puFfzbURxoÌ¢‰âÂå @calestous",3
331,Sitting in a room full of PhDs discussing the future of the Connected &amp; Autonomous Car. Technology changes everything. #connectedcar,3
332,Ì¢‰âÂÒ@CNET: Mercedes-Benz fully autonomous car re-creates world's first long-distance drive http://t.co/CkHlMMu9xPÌ¢‰âÂå woh..!! Are You SERIOUS..??,3
333,Can I get my autonomous car to bring me home some wine?  #GartnerSYM,3
334,"#cybersecurity The 'autonomous,' hackable car http://t.co/BEj6tr6XLB #infosec",3
335,See Volvo's Autonomous Parking Car in Action http://t.co/Dy75qfpQSX,3
336,See Volvo's Autonomous Parking Car in Action http://t.co/w21onhu3aq,3
337,I had a dream that I mastered the unicycle. Then I got run over by an autonomous car named Kit. I am not going to circus school now.,3
338,The #autonomous car is inevitable. #DriverlessCar http://t.co/ykWND0moN1,3
339,"@novatelinc GPS/INS onboard Ì¢‰âÂÒ@airandspace: Stanley, DARPA's autonomous car parked in #TimeNav http://t.co/NwO8m8UTMYÌ¢‰âÂå",3
340,Fascinating: The Next Autonomous Car Is a Truck. http://t.co/yWtXrvrLvM,3
341,"The Autonomous Car: A WWJ Business Breakfast, 6/5/13: Wednesday, June 5, 2013Registration, ContinentalBreakfast &amp;... http://t.co/XbU1fbbAaY",3
342,"Chevrolet's concept car EN-V, key feature: autonomous vehicle @JeffreyBrandes @SaintPetersblog #ItsNotWhitchcraft http://t.co/eh3QzlZ3XC",3
343,"This $10,000 Kit Makes Any Car (Almost) Autonomous http://t.co/i0YWjxcBr3",3
344,Autonomous car hack #seawear @MasheryDev @Inteliot http://t.co/hLuKaQSnT0,3
345,Autonomous car @ Volkswagen automotive innovation laboratory http://t.co/k3YxetKf,3
346,Engadget: Nissan Leaf prototype becomes first autonomous car to hit Japanese highways (video) http://t.co/llYBTJR0vW,3
347,Differentiating car experience will be a huge challenge/opportunity in autonomous cars - Mercedes benz #vlabauto,3
348,And it is Baidu's turn for a semi autonomous car...http://t.co/rhkCtGjOBk,3
349,"Educated guess: 20% of new car sales, in 10 years from now, will be from autonomous driving @MarkCPlatshon @BMWi",3
350,"""Oh, @Google is making an autonomous car... we'll make our own!"" http://t.co/3BUlKdEKob http://t.co/BZY5q1mIGH",3
351,MattÌ¢‰âÂ‰ã¢s Favorites: A Ride In An Autonomous Car And Much More: So whatÌ¢‰âÂ‰ã¢s the latest on a fine fall Monday? Put down... http://t.co/BlRSVMrrrj,3
352,"@ToThePoint_KCRW driverless cars make people see a car without a person in it. how about autonomous automobiles, shortened to auto auto",3
353,Autonomous car panel @ConnectedCarLA with @wsjeyesonroad @GoogleAuto #continental #CCELA http://t.co/wg2agdjCvT,3
354,"""@therealautoblog: Video: Autonomous car support subject of political attack ad http://t.co/wnBzgDRJ""",3
355,Truly autonomous: basically the car just goes. Maybe by 2025 to reach that point. #cas13,3
356,"Great evaluation on the moral consequences of autonomous car design.  Should the driver, or child on the road die? http://t.co/DHAKJCHFs3",3
357,Great summer for Shelley autonomous race car! Upgraded e-stop &amp; GPS for #Java safety system. New Java telemetry app and #JavaFX map editor.,3
358,. google autonomous vehicle. (Self-driving car) #automotive #tech @ Google http://t.co/vIaKmH3VwE,3
359,#Google autonomous car at the #Googleplex... Most likely nicknamed T-1000. #wereallgonnadie http://t.co/J9MnNHdqCe,3
360,@evanpower @SaintPetersblog Why a flying car when you can just have an autonomous car? Robot Death Cars and Drones. #skynet,3
361,@ae6rt Yes. The raspberry pi work for autonomous car telemetry data will be Christmas holidays project.,3
362,Keke.. Arthur's watching the video of the autonomous car I sent him from #SUExecProgram #fb http://t.co/4a8oTpXBU7,3
363,"Ì¢‰âÂÒ@eetimes: #Car, drive thyself in 2020: the race toward autonomous car design http://t.co/d0EI9tOuef #autoÌ¢‰âÂå @cdbradfield good stuff ahead",3
364,Selectable ethics for your autonomous car http://t.co/0thUk8gdFj . Could be bad if there was a hate #yyc #yycbike setting.,3
365,Driverless vehicles? Even in D.C. streets? An autonomous car takes a capital test run. http://t.co/R9TMGJnPns,3
366,Will it be illegal to drive wearing Google @projectglass ? Not if you're driving in an autonomous @google car I bet!,3
367,"@verge @zpower Unless the car has autonomous driving mode, then enjoy vids on the move.",3
368,#BLOG: How Close is Google's 'Autonomous Driver-less Car' From Reality http://t.co/O9ZOJ3Zo via @LoudTech_tk,3
369,#BLOG: How Close is Google's 'Autonomous Driver-less Car' From Reality http://t.co/K6Ssk08H via @LoudTech_tk,3
370,@CarGraB @kabakowski @Dinsmoor Agreed! Or just build an autonomous car real fast and make THAT drive you home.,3
371,autonomous car technology in my lifetime? just a blurb on NPR today.,3
372,"""Autonomous"" car technology RT @TheBayCitizen: Google's clout helps win legislative support for self-driving vehicles: http://t.co/qU3yiJYQ",3
373,@nissan hints next gen #titan will be shown at #naias 2015. Also says will make full autonomous car for production by 2020 #breaking news,3
374,Connected autonomous car technology (aka self driving) = real deal @Audi innovating. #MakeNextNow #CES2014,3
375,Aspiring car designers won @MichelinUSA Challenge Design for ideas to support the autonomous future of mobility http://t.co/Czjgr2xhyb,3
376,@NissanUSA pledges to mass produce a fully autonomous car by 2020 #NAIAS14,3
377,"If I was in the driver's side of an autonomous Google car and rolled up beside you and said ""hop in,"" would you? Y/N",3
378,@AutoNewsEurope RR the first autonomous car for the uber rich?,3
379,ICYMI: #Audi became the first car company to receive an autonomous car permit in California this week. The future is neeeeeeear.,3
380,Tesla CEO Musk Sees Fully Autonomous Car Ready in Five or Six Years. http://t.co/qxlhDpHWke,3
381,Autonomous car ready in 6 years: Tesla CEO http://t.co/vhE0ot1zke,3
382,"""The autonomous vehicle will change the urban landscape"" - @gabe_klein I'm not convinced but want to learn more #npsg",3
383,Audi gets Nevada's second autonomous vehicle license http://t.co/yQBCMJqq via @gizmag,3
384,Driving' CES into the future: The image of an autonomous vehicle is something we may see on Las Vegas valley roads... http://t.co/HZiuwCS0,3
385,Toyota and Lexus showcase autonomous research vehicle | TechHive http://t.co/i2w1Dg2g via @TechHive,3
386,Toyota Motor Corp and Lexus to reveal autonomous research vehicle at CES http://t.co/a1xqePZd,3
387,@WSJ doesn't #google already have an #autonomous vehicle?,3
388,WO2013138033A1 Actively Modifying A Field Of View Of An Autonomous Vehicle In View Of ... $GOOG #B60W #B60W30 http://t.co/ctn9yaakwT,3
389,@jpsz @MeetoftheMinds ÌâåÀWill autonomous vehicle manufacturers who assume all risk be the catalyst to adoption + disrupt insurance markets?,3
390,Ford and Google are looking to commercial this driver less (autonomous) vehicle...,3
391,"What? An ""autonomous vehicle""? Gotta look into it....",3
392,WO2013138000A1 Modifying Behavior Of Autonomous Vehicle Based On Predicted Behavior Of ... $GOOG #B60W #B60W30 http://t.co/gMDH12X3KL,3
393,"Completely agree with Bran Ferrin's quote at #TED2014: ""The next Pantheon is not the Internet - it's the autonomous vehicle.""",3
394,The drone/autonomous vehicle pool of $$$ will continue to grow.  - http://t.co/g6GNNxRcl1,3
395,Getting a very @isaacasimov vibe from #autonomous vehicle conversation with @samrakasim and @AMCaccavale. #govlabsxsw #DeloitteSXSW,3
396,Minnesota Autonomous Vehicle Meetup. (@ Hack Factory of Minnesota - @hackfactorymn) http://t.co/YV0myVzRLG,3
397,"@innov8tr hope our google overlords perfect the autonomous vehicle fast enough so we can text, FB and tweet without distractions.",3
398,At @sparkfun Autonomous Vehicle Competition with the kids. http://t.co/iccMWXtqhQ,3
399,@QNX_Auto QNX helps drive new autonomous vehicle project http://t.co/U3jFdb40Cw @QNX_Paul,3
400,hey @arduino check out #sharknado the #arduino powered autonomous vehicle https://t.co/NLKPz0Xupp #gps #magnetometer #ultrasonic,3
401,What's the proper procedure for a cop to pull over an autonomous vehicle?,3
402,"That's a good question... passenger override? ""@dweekly: What's the proper procedure for a cop to pull over an autonomous vehicle?""",3
403,"Google, be honest...this is the true inspiration for your ""autonomous"" vehicle. http://t.co/DLJhKqOEOD",3
404,@GregGardner12 @Reuters may be the last non-autonomous vehicle standing.,3
405,"The #UMichMTC autonomous vehicle testing facility @Umich is ""unique in the world,"" says David Munson. http://t.co/uSxSFgIXaJ",3
406,Design changes expectations; we may choose wearable device experience over driving- case for autonomous vehicle by @cauri @DisruptLASummit,3
407,"""First autonomous vehicle was the horse"" #techLA",3
408,WO2012154208A2 Transitioning A Mixed-mode Vehicle To Autonomous Mode #G05D #G05D1 http://t.co/YB9j52qf,3
409,DMV Solicits Public Feedback on Autonomous Vehicle Regulations http://t.co/CclvxcoCCF #scpick,3
410,"Google's Director of the Autonomous Vehicle Project, Anthony Levandowski #energyideas @Citizen_Energy @NYTenergy http://t.co/IxK3PD8QBO",3
411,"Will Autonomous Drive eventually preclude entire stages of vehicle development, shortening the lifecycle? Will dynamics matter? #TUdetroit",3
412,"First commercially avail autonomous vehicle in world to be made in US, with help from @TheJusticeDept Unicor &amp; used by @USArmy #SmartAmerica",3
413,"First commercially avail autonomous vehicle in world to be made in US, with help from @DeptofJustice, and used by @USArmy #SmartAmerica",3
414,"Ohio State launches $4.3 million center to study &amp; advance vehicle safety, funded by @USDOT http://t.co/OzO778rFzI #autonomous",3
415,WO2013052140A2 Autonomous Vehicle System #A63H #A63H29 http://t.co/8ag37J71Y6,3
416,Heard it thru the grapevine: Apple started autonomous vehicle R&amp;D effort to compete w/Google. Already poaching engineers from other co's.,3
417,CMU Autonomous vehicle @CarnegieMellon http://t.co/r4BxwFSqCL,3
418,#Google Enters Autonomous Vehicle in #NASCAR Series  http://t.co/R567z3PHhM #engineering,3
419,At the Petersen discussing the autonomous vehicle future. http://t.co/8Dq5HDRXfd,3
420,What would entice you to get behind the wheel of an autonomous vehicle? New study shows the possibilities. @edmunds http://t.co/qox9BfKohN,3
421,"Scissors, meet ribbon. @OSUCtrAutoRsrch expands facilities for #autonomous #intelligent vehicle research http://t.co/SZhZAzhdEU",3
422,Senator @JeffreyBrandes showcases @Audi autonomous vehicle technology in #Tampa #sayfie #FlaPol http://t.co/AualU4fY7V,3
423,Kinda tempted to start playing reverse bumper tag with google unpersoned autonomous vehicle behind #DoesThisCarReallyKnow,3
424,"Rajkumar: for foreseeable future, a human must be available in drivers seat to take control even if vehicle is autonomous capable #AVhearing",3
425,"Ohio State autonomous vehicle expert featured in @CarInsurance.com article ""The computer in the next lane"" http://t.co/kgGadl4YBI",3
