id,text,sentiment_SVM_5
634,"Projections show by 2060 - gvt could mandate driverless cars; goodbye to drunk driving, backseat driver &amp; the cherished leisure drive #SXSW",3
635,California mulls how to regulate 'driverless cars': LOS ANGELES Ì¢‰âÂ‰Û California's Department of Motor Vehicles is... http://t.co/tvqL0u2rH5,3
636,California mulls how to regulate 'driverless cars' http://t.co/pVWj3j6woF,3
637,"Ì¢‰âÂÒSwivel seats, big screen, espresso machine - inside the driverless car of the future http://t.co/WdbgQwhj1K http://t.co/axu5xI0RPGÌ¢‰âÂå",3
638,Hivemind driverless cars are the last step b4 the singularity/war with the machines. Bring it Google! We're ready.,3
639,Crushing in a Google driverless car http://t.co/cZtxbr4d1I,3
640,Ì¢‰âÂÒ@aviationtoday: Ì¢‰âÂèÏYouÌ¢‰âÂ‰ã¢ll See Driverless CarsÌ¢‰âÂ‰ã¢ Before UAVs in US http://t.co/kRDeL7leCwÌ¢‰âÂå @onthefly305,3
641,Calif. pushes to finish driverless car rules http://t.co/M0JF8aM3PY @USAtoday @ChrisWoodyard #DriverlessCars #SelfDrivingCars #tech #cars,3
642,"#drones on the brain? Nope, it's #driverless #cars first, says #satshow expert http://t.co/OuLlNtF9Q5",3
643,Michigan leads research in connected and driverless cars.  @UMTRI @onetoughnerd @transpoman  http://t.co/mqCSV1Q8Gv,3
644,Interesting challenge for driverless cars: picking up people at the airport in busy arrivals roadway. Use phone as homing device?,3
645,"By The Time Your Car Goes Driverless, You Won't Know The Difference http://t.co/wrBV2T2jZF",3
646,"""Florida is one of three states leading the way for #driverless vehicles."" -Nancy Sikes-Kline from @NorthFloridaTPO #transportationtomorrow",3
647,@stanfordlaw @StanfordCIS @rcalo @npralltech -- same with driverless cars,2
648,"@BloombergNews Automation From Flying to Driverless AutOS,med deliverance, doctor Exams,Distant Learning;Huge webinars QUALITY INSTRUCTORS!",3
649,.@anyaigo @jstuart197 Oh look! A driverless car! http://t.co/5QJBlALmRo,3
650,"@jen_keesmaat @WaterfrontTO I assume this doesn't factor in the impact of driverless cars, which will undoubtedly be ubiquitous by then.",3
651,Did we mention we're testing Google's driverless car? #google #CrackerBarrel @SteveJobsDQuote http://t.co/x9Jextpsuu,3
652,@sassysomethin the driverless car of the future http://t.co/rB7q1H6adI http://t.co/QaciASwmETÌ¢‰âÂå,3
653,"#ENRtech at SF construction tech conference.  With driverless cars coming soon, will we need parking lots?",3
654,Predictions of great economics from driverless cars. We shall see if indeed these machines offset the unemployment http://t.co/H9qQnJMwwT,3
655,Driverless car arrives at the Geneva Motor Show via @NYPost  http://t.co/F91SK1t5pu #lookmomnohands #carfanatic,3
656,Heated debate regarding future of driverless cars.  Solution or debacle? #CitiesontheMove,3
657,@esurance driverless for why could it not fly as well.,1
658,Ì¢‰âÂÒ@BBCWorld: Inside the driverless car of the future. (I just tweeted this cuz she's hot) http://t.co/wEXSnmBtro http://t.co/alimVETl0yÌ¢‰âÂå,3
659,"@noahpransky If a driverless car gets a #redlightcamera ticket and no one is in the car to be ticketed, did it ever really happen?",3
660,"It's time! @adriansipe Ì¢‰âÂÒ@BBCWorld: Swivel seats, big screen, espresso machine: driverless car http://t.co/FM7ghMToPJ http://t.co/RuKi1Lp3ItÌ¢‰âÂå",3
661,Journey inside a driverless car http://t.co/utvhgtdqCE,3
662,Will the government still make money off tickets if all cars are driverless? #lostrevenue #driverlesscar #Autonomous #sxsw,3
663,What is the regulatory environment for driverless cars? Will regulation hold us up? #Autonomous #govlabsxsw #SXSW #driverlesscar,3
664,@aarieff But otherwise driverless car will be both challenge and boon to walkable urbanism.,3
665,California mulls how to regulate 'driverless cars': California's Department of Motor Vehicles is wading into the... http://t.co/1uHn2H0NPV,3
666,"California Mulls How To Regulate 'Driverless Cars': On Tuesday, the California Department of Motor Vehicles held... http://t.co/7JLU7NdNyi",3
667,with enough bricks on the gas pedal any car can be a driverless car,3
668,"#sxsw #techtrends Shapiro, man behind CES, talks of food trends, including delivery of groceries by driverless cars and drones. Stay tuned.",3
669,"Retail now: buy in store or online; In the future: produce via 3D printer, have it delivered via drone or driverless car #SXSW #techtrends",3
670,#techtrends talking about drones &amp; driverless cars making home deliveries #shitthatphilsays @AlexisNasc @akgroom @Shippysays,3
671,RE: driverless cars: Interesting question. Who's responsible for the algorithm that decides who lives &amp; who dies in a split second decision?,3
672,California pushes to finish driverless car rules http://t.co/mlfnuhMlhE,3
673,Ì¢‰âÂÒ@NBCLA: Driverless cars could become commercially available by the end of the decade http://t.co/BTKrBuPHymÌ¢‰âÂåÌ¡üèÏå_Ì¡ü‰ã¢ÕÌ¡ü‰ã¢ÕÌ¡ü‰ã¢Õ,3
674,"@veen @megnut Is it clear thereÌ¢‰âÂ‰ã¢d be a compelling efficiency improvement with driverless EVÌ¢‰âÂ‰ã¢s, or are we just relocating burning fuel?",3
675,"Seriously doubting that ""Automakers agree most cars will be driverless by 2020"" @reddit_tech @511SFBay @edmunds @getcarscout @CarfaxReports",3
676,Swiss Re Canada CEO Sharon Ludlow considering the future of insuring drones and driverless cars at 29th annual outlook breakfast.,3
677,"Data, driverless cars and the future of the insurance business http://t.co/cSK122Qe1F",3
678,From driverless cars to wearable computers: digital drives today's business http://t.co/wdISXDePD7 @LarsNCoGraphy @Alberto_Zetina,3
679,"@changeist Populist theorists as driverless cars Ì¢‰âÂ‰ÛÏ am I reading into that metaphor too much, or just enough?",3
680,"Driverless cars, no manual override, gov or corp owned, only go to approved places, all trips recorded, passenger compartment on video.",3
681,"Did I just see a Google driverless car turning north at College and 10th, or is my mind playing tricks? #indy",3
682,Will government regulation crash driverless cars? http://t.co/OXSTuP6V27,3
683,Google driverless car under the California sunshine @ Googleplex http://t.co/WkVF3WgVtS,3
684,"When will #Michigan get in the fast lane with #California, #Florida &amp; #Nevada in development of #driverless cars? http://t.co/SZ8TZvuZON",3
685,100 mph and then you let go: BMW's driverless car http://t.co/Kep3IU1iVh via @Appy_Geek,1
686,"""A driverless car invented by Google has completed 300k+ miles and has 2 accidents, humans in other cars hit it.""",4
687,Today in SJ: what impact will driverless cars have on our roads and cities? How much of a change are we talking? http://t.co/IqXDuCTE7N,3
688,Strange to pass a Google driverless car on the Silicon Valley 101 interstate #innovation #bemissionusa http://t.co/mXerxtaPx6,3
689,"Ì¢‰âÂÒDriverless cars, pilotless planes Ì¢‰âÂå_ will there be jobs left for a human being?Ì¢‰âÂå  http://t.co/XAzYomxUWp",3
690,Driver-less cars? Like is 2013 serious right now,3
691,Cars without drivers: DMV to hold June 18 workshop on driverless vehicle regulations http://t.co/O3o38Hovgk #scpick,3
692,anki drive - take that google driverless car!! #wwdc,3
693,WHAT!!! Driverless Cars in California? I thought that's what was all we had!,3
694,Google is investing in driverless cars &amp; launching internet-enabled blimps. Meanwhile FB engineers added another 9 seconds to mobile videos.,3
695,Guess what one thing would make this racing school founder want a driverless car: Driverless cars sound like a... http://t.co/sPyPbho9Eo,3
696,Ì¢‰âÂÒ@anthonymobile: Will a World of Driverless Cars Be Heaven or Hell? http://t.co/EsmaacvssDÌ¢‰âÂå #cities #urbanism,3
697,RT .@TheAtlantic: Will a world of driverless cars be heaven or hell? http://t.co/oARdEnEdEk #innovation #transportation @BIDtransporte,3
698,The future is near. @FastCompany: Our Ultimate Driverless Car Report Card http://t.co/8WdAtkjAap,3
699,Ì¢‰âÂÒ@driverlesscarhq: Self-stopping cars are just the start for next gen safety systems -Gabe http://t.co/AUGND7cSV7Ì¢‰âÂå not enough - #driverless,3
700,Could a driverless car call 911 if involved in an accident. Why not. #mobiletech,3
701,@tomfriedman - George Jetson drove his own flying saucer - they hadn't even conceived of a driverless vehicle. #fewerjobs,3
702,@JoshRosner passive fishing or a pre-test for driver-less taxis?,3
703,driverless cars  horseless carriages,3
704,"Robots? Driverless Cars? Listen, we were all promised Hoverboards back in 85! @pewresearch http://t.co/egV7Z22Bmj",3
705,Google's driverless cars are going to have to obey all traffic laws. Period. Wait until people get their heads around that.,3
706,How Drones And Driverless Cars Raise Questions For The Future Of City Services  By @BrooksRainwater http://t.co/H3BmeAF3QO via @FastCompany,3
707,Google: Driverless cars are mastering city streets | Voices: http://t.co/0igqm51yND,3
708,Are Drivers required to cross state lines? California and Nevada allow driverless cars and share border over 500 miles long.,3
709,GoogleÌ¢‰âÂ‰ã¢s Driverless Cars Master City Streets: LOS ANGELES (AP) - Google says it has turned a corner in its... http://t.co/uLO9aLitP2,3
710,Ì¢‰âÂÒ@AtlanticCities: Why the future of practical driverless cars might be decided in Florida http://t.co/9O5M6dExGpÌ¢‰âÂå test it out on seniors!,3
711,Driverless cars + graphene = flying cars like in Blade Runner,3
712,"@mattyglesias what if there's incentive? Ask same, but driverless vehicles pay no insurance = response goes positive.",3
713,"In this audio clip, APA member Don Howard says ""there will be some resistance"" to driverless vehicles. http://t.co/XdpzN7g1k9",3
714,"So close to the next giant leap in history: driverless cars, smart homes &amp; offices, private space travel, cyborg bodies, cashless payments",3
715,"@scottleibrand when there are driverless cars, IÌ¢‰âÂ‰ã¢m junk-punching anyone not on mass transit.",3
716,Interesting thoughts on driverless car and first responders. Never pondered the possibilities before. #driverlesscar,3
717,"@SteveLittleLive The first stage will be that families downsize to 1 car. Driverless cars could be sent to other family members, as needed.",3
718,Google: Driverless cars are mastering city streets: Google says it has turned a corner in its pursuit of a car... http://t.co/y9o74Es64o,3
719,Google: Driverless Cars Are Mastering City Streets: Google says it has turned a corner in its pursuit of a car... http://t.co/uxz7xtvDXt,3
720,"Ì¢‰âÂÒ@FastCompanyhow Google's driverless cars navigate traffic, bikes, and road construction http://t.co/mwu45UHEkv http://t.co/To1xDK7ECBÌ¢‰âÂå",3
721,"YES. #ihatedriving RT @FastCompany: Watch: How Google's driverless cars navigate traffic, bikes, &amp; road construction http://t.co/g7EeD0ne0o",3
722,Great overview of #google #driverless cars.  http://t.co/MTEbpdSglN,3
723,"""@llkirstenll: #Google: #Driverless #cars mastering city streets, jaywalkers and all   #wral http://t.co/zfYGqMkOjm",3
724,Google: Driverless cars are mastering city streets http://t.co/qV7Hs6fvs7 (from @AP),4
725,@jaymohr37 the driverless car was funded by Sterling so Jessica Tandy didn't need Morgan Freeman to drive her around anymore #jaymohrsports,3
726,Great question! RT @TheAtlantic: A driverless car gets into an accident. How does the law handle it? http://t.co/rwIrJPgP5N,3
727,Google: Driverless cars are mastering city street: Google says that cars it has programmed to drive themselves... http://t.co/BPHAETCI86,4
728,Ok- dare you to tKe a spin in #NYC...@CNBC: Google's driverless car is city-ready: http://t.co/F4mE0I3jEh $GOOGÌ¢‰âÂå,3
729,Ì¢‰âÂÒ@driverlesstrans: #Driverless cars inch their way closer to reality  @gulf_news.http://t.co/OC5c8P6hkr http://t.co/c4cfQHiSOgÌ¢‰âÂå it's coming,3
730,"@steveschale @jenlux @JamesGrantFL On a road w/no redlight cams, in a driverless car that is (optionally) covered by private flood insurance",3
731,"In a world where driverless cars are not that far in the future, how's it possible that there are still engineers driving trains??",3
732,How about driverless cars and driving you to the hospital if you were out in and needed help. #mobiletech,3
733,"Ì¢‰âÂÒ@FastCompany: Watch: This is how Google's driverless cars navigate traffic, bikes, and road construction http://t.co/ExMTIraK1i""",3
734,"Driverless cars overcome jaywalkers, blind corners: Google: Google says it has turned a corner in its pursuit of... http://t.co/4dVtrqgPMO",3
735,"""@TheAtlantic: What happens when a driverless car runs into road construction? http://t.co/BV07FAs0yP""",3
736,RT @CaliCam: Google working on driverless cars and you niggas still trying to figure out how to get a music video on WSHH.,3
737,Ì¢‰âÂÒ@driverlesstrans: #Driverless Cars Will Change How You Run Your Business via @PSMJ_Resources   http://t.co/b6RYvGPTEUÌ¢‰âÂå let it be soon!,3
738,Driverless cars and the future. #iicf http://t.co/lHSYEpD49l,3
739,"Jaywalkers, cyclists, blind corners: Google says its driverless cars mastering city streets: Google says that... http://t.co/SfBOvLfIBT",3
740,Our #DigitalTech Dir.@JohnDVillasenor wrote a report abt driverless cars &amp; liability for @BrookingsInst http://t.co/CmA7LPQSJD @TheAtlantic,3
741,GoogleÌ¢‰âÂ‰ã¢s Driverless Cars Reportedly Mastering City Streets: LOS ANGELES (AP) Ì¢‰âÂ‰Û Google says that cars it is... http://t.co/XWOUQfX2JT,3
742,Ì¢‰âÂÒ@CNBC: Google's driverless car is city-ready: http://t.co/P4qmehwKOn $GOOG @brooksmorgan @collinkmorgan,3
743,Google says its driverless cars are mastering city streets: Google says it has turned a corner in its pursuit of... http://t.co/zokaiJVEqG,3
744,I wrote Friday that we shouldn't overregulate driverless cars; today AP writes on Google Car! http://t.co/yPDVZLgS5l http://t.co/1GHvQwL7HD,3
745,Google: Driverless cars are mastering city streets: LOS ANGELES Ì¢‰âÂ‰Û Google says it has turned a corner in its... http://t.co/n7wXjrNpXz,3
746,Google says its driverless cars mastering city streets: Google says it has turned a corner in its pursuit of a... http://t.co/w39Se2eMnU,3
747,Who is at fault when a driverless car crashes? @Brookings report (http://t.co/KUXmHtKP4r) proposes legal framework. Need same for med tech?,3
748,Google Says Driverless Cars Are Mastering City Streets: MOUNTAIN VIEW (CBS / AP) Ì¢‰âÂ‰Û Google says that cars it is... http://t.co/6dYyW4uMR6,3
749,I'm on CFRB at 8.15 to talk about driverless cars @Globe_Drive @globeandmail,3
750,apparently there are now driver less cars in LA?,3
751,@parisandjune oh my no. Cars are not driverless yet dear.,3
752,"On I-880, my first driverless car sighting... I think it's taking itself to the #A's game. ;-) LET'S GO #OAKLAND!!! http://t.co/sYSZpcO3",3
753,You're watching... Driverless cars set to hit the road :http://t.co/VOuxAZ2u  Becoming law sounds crazy look for yourself,3
754,#fvrlfrey Driverless cars are coming. In 10 yrs we will see many. Ag world is ahead in this. #Langley http://t.co/VCzhi7sa,3
755,"Hey @Google, how about releasing tests and test results for those software-controlled driverless cars in California? Curious about safety.",3
756,"On I-880, my first driverless car sighting... I think it's taking itself to the A's game. ;-) LET'S GO OAKLAND!!! http://t.co/EOzNorZK",3
757,China to test driverless cars for 75 miles - http://t.co/Hpa0r7tA,3
758,"Better tires for small, driverless cars Ì¢‰âÂÒ@ecomagination: @Parabola_Arc What would be the first thing you #upcycle a tire into?Ì¢‰âÂå",3
759,@transitdude Clearly you've never seen a futuristic movie with driverless cars. I recommend iRobot.,3
760,Driverless cars will change everything. http://t.co/QBWOiGiX,3
761,"Driverless Cars Street Legal Now In Three States, If The Computer Crashes Your Car Is It Your Fault? http://t.co/q1USSIlA #cars #autos",3
762,"Changing Gloria's tire she says ""now what would have happened if I were in a driverless #car and the tire went flat."" http://t.co/v6v1Abq6",3
763,"Robot chauffeurs at wheel of the future - SFGate http://t.co/o0OVuMVA  #""driverless"" vehicles Ìª‰ÛÁÌ÷å¡Ì÷å¤ Ìª‰Û_Ìª‰Û_Ì÷å¤Ìª‰Û_ Ì÷å¬Ì÷å_ÌªÊÌ÷åá",3
764,Obesity Ì¢Ò‰Û  Glass social interfacing and driverless cars forthcoming.,3
765,"@jtnt short-term investing: when weÌ¢‰âÂ‰ã¢re all in driverless cars, we wonÌ¢‰âÂ‰ã¢t need all those roads ;)",3
766,Think of the reinvention needed for trucking and taxis when this comes. NYTs: Driverless Cars Know the Way to San Jose http://t.co/Ow2xE63a,3
767,Last week California legalized driverless cars. -Hersman #NTSB,3
768,Someone at Google should announce that their driverless cars will be programmed give all cyclists 3 feet of room.,3
769,On my way to ohare airport and we pass a driverless car at 70mph http://t.co/LawtGHEX,3
770,See you on the road in 6. Ì¢‰âÂÒ@kytja: DC looking at legalizing driver-less cars though they won't be available until2018 http://t.co/te5s9qojÌ¢‰âÂå,3
771,Sebastian Thrun on Google Glass and the Driverless Car (@ CCIS 1-430) http://t.co/eQhqUEc4,3
772,The driverless road ahead: http://t.co/pmKKKmch,3
773,"@fuckbitsgetMANI you included future ""driverless cars"" &amp; ""bionic lenses""?",3
774,-- Google steers new course with driverless car - http://t.co/25n0paUVs6,3
775,"Wait, they've invented a driver-less car?",3
776,@pmarca The big difference w/ driverless cars will be associated with car ownership.,3
777,New York Times article on self-driving cars. GoogleÌ¢‰âÂ‰ã¢s Next Phase in Driverless Cars: No Brakes or Steering Wheel http://t.co/Q8y5htunuW,3
778,"Google to build ""Driverless Cars"" ... What does this mean for #DUILaw ?   http://t.co/MMHvMbWZzb",3
779,Could Google's interest in driverless cars spark a resurgence in 1940/50s-style cybernetics? http://t.co/IRE1naoYeN @markoff,3
780,"""The current cost of taxi service in NYC would be $4 per trip mile...a driverless fleet would be ~$.50"" http://t.co/hocZqEOLA0",3
781,Can I get a driverless car to drive my telepresence-bot everyplace I'm supposed to go? Then I could just stay home.,3
782,After my Google Driver-less Car drops me off at @statebirdsf where does it go? Back Home?,3
783,@DrPizza also we banned segways because they're too dorky. No way people don't ban driverless cars.,3
784,Ì¢‰âÂÒ@HawaiiReporter: Driverless Cars. What's Really Possible? http://t.co/2wq0Mhbw4lÌ¢‰âÂå,3
785,Co-hosting @LangandOLeary w. @AmandaLang_CBC tonight. We dig deep into the winners and losers in a world of Google driverless cars. #cbclolx,3
786,Google's new driverless #car. Think I saw several on the road today.,3
787,Autonomous net zero vehicles best  NYT: GoogleÌ¢‰âÂ‰ã¢s Next Phase in Driverless Cars: No Brakes or Steering Wheel http://t.co/NhEkmxGNDp,3
788,@rakeshtondon @TechCrunch In 3 years we will have both ridden in a driverless uber ride.,3
789,Diver?! RT:@abc7newsBayArea: Google unveils its new driverless car. http://t.co/W1WLy69mUR It has no steering wheel or diver pedals.Ì¢‰âÂå,3
790,"Will we ever trust a driverless car? Most won't, however our children most certainly will.",3
791,Driverless cars don't hold their breath in tunnels... http://t.co/k3KsgMXV4D,3
792,How long before @Uber deploys its first driverless car? #FullyAutomated,3
793,"Driverless cars have sensors to warn ""inattentive"" drivers. What?! No napping?!?!? Why else have driverless car? https://t.co/fkoVORfVzp",3
794,Our thrilling (and terrifying) future with the driverless car http://t.co/NR0TsndWqD,3
795,Qualcomm wants to make eyes for driverless cars   http://t.co/cgnGTyvjot,3
796,"Can someone net out this driverless Google car thing? Are you considered a driver or a passenger and most of all, do you need to be sober?",3
797,"RT @PandoDaily: While Google and Amazon tinker with driverless cars and drones, Apple is stuck in the past: http://t.co/HFeK8Uquab",3
798,The Economist | Driverless cars: In self-driving seat #google can design without #legacy. #digital #cars @BizTechMBA  http://t.co/xpo4XE28hj,3
799,"How Google got states to legalize driverless cars: MOUNTAIN VIEW, Calif. Ì¢‰âÂ‰Û About four years ago, the Google team... http://t.co/IMKSEN6OU3",3
800,DRIVERLESS. CAR.,1
801,Interesting debate @Gizmodo: Should your driverless car kill you to save two other people? Discuss it here! http://t.co/fHifI5hhyk,3
802,@CBC @CBCThisIsThat  where are the google driverless cars? The should launch in nova Scotia soon!!,3
803,"@MikeJudge #SiliconValleyHBO eps 6 is classic. #PakistaniDenzel, Jared driverless car, Erlich speedo! @RealErlich @AviatoInc @PiedPiperHBO",3
804,"@dsucher @BrentToderian Driverless cars won't be panacea for aging in place. They won't bring human scale, community, social life to sprawl.",3
805,California approves rules to test #driverless car on public roads http://t.co/dlFuOBbr9i,3
806,A driverless car may get a California license before I do http://t.co/Lt7QsBh4lS,3
807,"Google's driverless car is ready for CA test-markets, and will have regulatory framework to do so by end of year. https://t.co/XRXbexT8jw",3
808,Driverless cars will be widely available by 2020. - Dr. Kaku at #CCJSYMP,3
809,Horseless Carriage : Car :: Driverless Car : ???,3
810,In the near future we'll have driverless cars that drive to work every morning while we jog in.,3
811,. @scott_kerr defeats the purpose of a driver-less car if I have to pay attention to if someone's driving (or not!). Whats the QR code for?,3
812,"GM, Ford, Toyota join UM in establishing driverless car test site in Ann Arbor: Associated Press - General... http://t.co/lzGwn6KUiI",3
813,U-M center breaks ground on facility to test driverless vehicles: http://t.co/Wbhyq2Eulo,3
814,The Google driverless car has encountered 2 accidents. 1st it was rear ended @ a stop sign &amp; 2nd a human was driving. http://t.co/xF1Jnt2XgA,3
815,"Go read @WIRED mag's new piece on driverless cars, collisions, and morality and then think about wearing a bike helmet again. #thefuture",3
816,"""@HuffPostTech: How Google got states to legalize driverless cars http://t.co/b7zwWfMNUH"" Now that's how you write regulations",3
817,A look at the roadblocks facing driverless cars: Google Inc. is pushing hard to bring cars driven by computers Ì¢‰âÂ‰Û... http://t.co/OYsrB18sqq,3
818,"@radfkr @SebOrSam Park a fleet of driverless cars at suburban train stations and boom, no huge parking garage or fancy new tech required.",3
819,How Google Got States to Legalize Driverless Cars http://t.co/WABMJC6UYV,3
820,"http://t.co/GP3BdhL55J @grmpyprogrammer: I wonder if there is any footage available of a ""driverless"" car actually getting into an accident",3
821,"How Google got states to legalize driverless cars: About four years ago, the Google team trying to develop cars... http://t.co/79f0tUy7VQ",3
822,@0ne_AM How Google got states to legalize driverless cars http://t.co/LxK1srXCDm (from @AP),3
823,Google Plans to Launch 100 Driverless Cars by Next Year - DailyFinance http://t.co/cq8BnKwWII,3
824,Another look at the driverless cars via @lloydalter -  How will the driverless car affect the design of our cities? http://t.co/DefbJM8wph,3
825,Driving Sideways: The Driverless Car http://t.co/4thEXtQf8K,3
826,How Driverless Cars Could Reshape Cities http://t.co/izT8jFXtsD,3
827,"@The_ISSIP Ì¢‰âÂÒ@nickbilton: Disruptions: How Driverless Cars, Delivery Drones and Robots Will Reshape Cities: http://t.co/he4eVbCrG1Ì¢‰âÂå #ISSIP",3
828,"How Driverless Cars Could Reshape Cities, via @nytimes http://t.co/hjZ1CWDCGQ",3
829,Real challenge to Google's driverless cars:  Israeli startup Mobileye raises $400M w/ cheaper tech http://t.co/hqLGazafyQ via @zite,3
830,@nathanjurgenson Driverless cars will likely end up as autonomous as future aerial drones. One key difference though: AI cars are Ì¢‰âÂÒmannedÌ¢‰âÂå.,3
831,How Will Driverless Cars Reshape Cities? http://t.co/LtOG5BWTZr,3
832,How Driverless Cars Could Reshape Cities: http://t.co/2oEpJFeOfM,3
833,BBC News - Driverless cars to be tested on UK roads by end of 2013 http://t.co/WwIgj8Lajs,3
834,@jowyang Or maybe dismay at the rest of the industry. Same for driverless cars.,3
835,Google face pressure to slow down rollout of driverless car technology http://t.co/Fj8GL65t91 via @Appy_Geek. Way cool,3
836,How driverless cars could reshape cities http://t.co/WJSHYztjlj,3
837,Talk about an emerging industry RTÌ¢‰âÂÒ@alexisohanian: Disruptions: How Driverless Cars Could Reshape Cities http://t.co/fz78aCX9y6Ì¢‰âÂå,3
838,"Driver less cars that can drop you off park and then pick up back up using your cell phone, howÌ¢‰âÂå_ http://t.co/5VhLBhJDDD",3
839,"Kean Says NJ Could Go 'Driverless' http://t.co/NGCXVO4zXA Mike Smolensky, Esq. #trafficticketattorney http://t.co/hBCRSu3aMN",3
840,"Personally, I think ""driverless cars"" make more sense if you think about them as ""rideable robots"": http://t.co/NrLOdfFN3a via @aarieff",3
841,Must read @aarieff piece on the promisesÌ¢‰âÂ‰Ûand perilsÌ¢‰âÂ‰Ûof driverless cars: http://t.co/9aQ3pwFHEn,3
842,Next step after driverless cars: passengerless cars.,3
843,"Can driverless cars reshape L.A. and other cities?: Mark Lacter: Way too early to know, though researchers are... http://t.co/n4uvURM4q5",3
