id,text,sentiment_SVM_5
1,Two places I'd invest all my money if I could: 3D printing and Self-driving cars!!!,3
2,Awesome! Google driverless cars will help the blind travel more often; https://t.co/QWuXR0FrBpv,5
3,Autonomous vehicles could reduce traffic fatalities by 90%...I'm in!,5
4,Really good presentation from Jan Becker on Bosch's automated vehicle research. #AutoAuto check it out,5
5,Ford just revealed it's Automated Ford Fusion Hybrid Vehicle. Pretty amazing. #fordtrends @ Ford TestÌ¢‰âÂå_ http://t.co/7axya8ogIW,5
6,"So yeah, just throwing this out there again. Would totally be down to beta test an autonomous car.",5
7,"@TeslaMotors Musk reluctant to partner with Apple, Google, but an Android controlled, autonomous smart-car would be awesome!!",5
8,Finished SF&gt;LA drive. Now itÌ¢‰âÂ‰ã¢s LA&gt;OC in rush hour for a meeting. I canÌ¢‰âÂ‰ã¢t wait for an autonomous google car.,5
9,"The #Google autonomous car paid a visit to Nvidia HQ. Pretty cool technology, but as a person whoÌ¢‰âÂå_ http://t.co/rjQ5Td78fj",5
10,"Finally, a very realistic timeline for full autonomous car capability. Hats off, @MorganStanley #AutoForum http://t.co/ZwemgV5JF8",5
11,"It'll be cool when cars are fully autonomous, cause I'm totally gonna sleep while my car drives.",5
12,Autonomous car driving could free up the $200 billion that's wasted in car insurance.,5
13,Awesome! #Google builds the first purpose-built autonomous vehicle #SelfDrivenCar http://t.co/jfU7h4xevG,5
14,I'm glad I have a semi-autonomous vehicle. This heavy rain was worse than driving in a blizzard! #weatherwednesday http://t.co/JiBihB12Mx,5
15,Chris Urmson (@googleresearch @CarnegieMellon) really boosted my hope for autonomous vehicle viability in the near future #RoboBusiness,5
16,@sherod @erikbryn drive a partially autonomous vehicle (radar cruise control) and you will be a believer. The tech is a life saver.,5
17,"Jeff Owens, @DelphiAuto CTO: A fully autonomous vehicle is a moon shot for our industry. #MBS2014 http://t.co/BccKZiPnX8",5
18,"Yes!!!!! MT ""@mims: Elon Musk says Tesla's fully-autonomous electric vehicle will be on the road in 5-6 years http://t.co/rAoQQP1fLV""",5
19,Dear @GoogleVentures: please hurry with the driverless cars. 'Cuz the ones driven by humans are making me CRAZY!!!,5
20,I wish I had a driverless car right now @thetechblock #dd,5
21,@salimismail - driverless cars will save $6bn in time $2.5bn in accident costs. We will ask why we let humans drive. @GUimpact launch,5
22,http://t.co/lsyL4Qfccw  Half of Americans want to live in a smart city with driverless cars,5
23,I hope it's sooner! Ì¢‰âÂÒ@prioritydata: A study suggests that nearly all cars are expected to be driverless by 2050. http://t.co/FfMugvFEppÌ¢‰âÂå,5
24,"Ì¢‰âÂÒ@joelgascoigne: ""Fasten Your Seatbelts: Google's Driverless Car Is Worth Trillions"" http://t.co/GfwZqj0ZÌ¢‰âÂå I want it :)",4
25,"my dad is OBSESSED with this google driverless car. ""THIS IS HAPPENING. ARTIFICIAL INTELLIGENCE"" ""WHEN YOU'RE AN ADULT, ITS GONNA HAPPEN""",5
26,Innovation at its finest RTÌ¢‰âÂÒ@ForbesTech: Google's trillion $$ driverless car will b commercialized sooner than u think http://t.co/jQa3MIjTÌ¢‰âÂå,5
27,""" A driverless car invented by Google has completed over 300k miles and only had two accidents when humans in other cars hit it.""",4
28,I can't wait for this to be standard. Ì¢‰âÂÒ@Forbes: Fasten your seatbelts: Google's driverless car is worth trillions http://t.co/ielHE36DÌ¢‰âÂå,5
29,This is honestly the coolest thing ever...Ì¢‰âÂÒ@Forbes: Fasten your seatbelts: Google's driverless car is worth trillions http://t.co/lTYYr1PwÌ¢‰âÂå,5
30,saw the audi new driver less parking technology...it is really awesome,5
31,@fawnjohnson Car accidents are the primary killer of Americans. Driverless cars will end that. We should be doing all we can to get there.,5
32,"This is cool: Swivel seats, big screen, espresso. Inside the driverless car of the future http://t.co/dFkywEtTwW http://t.co/IrHrelyajM",5
33,@AHBSradio @drvrls I would LOVE a driverless car!! #GreatIdea,5
34,"I'd love to see @google rethink the inside of cars now that they're #driverless, so much could change for the better! http://t.co/0dkPSjcwVa",5
35,"Ì¢‰âÂÒ@theanisilmi: If driverless car exists, I'll be glad to have it lol.Ì¢‰âÂå Can't come soon enough #30kperyear auto accident deaths",3
36,"When fully implemented, driverless vehicles could reduce accidents by 90%, saving 35k+ lives in the US each year. #transportationtomorrow",5
37,"Yes pls! RT Ì¢‰âÂÒ@Colin_Sebastian: Google says they hope to use driverless cars for shopping delivery in a ""few years"" #droneswithoutwingsÌ¢‰âÂå",3
38,Can we have driverless cars already.,2
39,Ì¢‰âÂÒ@Forbes: It's time for the auto industry to create a new Model T http://t.co/RWgu3ymGXlÌ¢‰âÂå yes a #driverless Model T,5
40,Good! Now to ensure politicians don't stand in the way! Ì¢‰âÂÒGoogle says its driverless cars are ready for city streets: http://t.co/Y6g6HmsXRqÌ¢‰âÂå,5
41,"@NBCLA @joemmathews I can't wait for a driverless future, soooo cooooool!",5
42,Great presentation at the @UAlberta this afternoon from Sebastian Thrun on driverless cars. Really fascinating stuff.,5
43,Driverless cars? Cool!,4
44,THANK ALLAH. Can't come fast enough.  The Economist | Schumpeter: The driverless road ahead http://t.co/SUrJJGpq via @theeconomist,5
45,I want to sit all day at CodeCon! Driverless cars and the Skype instant translator are uber cool!  #codecon,5
46,Google plans on having 100 driverless cars on the road by next year. DriverLESS. Cars. So cool,5
47,When can I get one? #signmeup #want #thefuture #socool Ì¡üÁ‰ÛÓ RT @HuffingtonPost: Meet Google's newest driverless car http://t.co/aUhE3jsRM0,5
48,#Marylanddrivers RT @TonyFratto: Driverless cars can't come soon enough.,5
49,Ì¢‰âÂÒ@alexisohanian: I'm so ready. Disruptions: How Driverless Cars Could Reshape Cities http://t.co/Osxq85KPvsÌ¢‰âÂå the future!!,3
50,A driverless car invented by Google has completed over 300k miles and only had two accidents when humans in other cars hit it. GOOD MORNING!,5
51,I'm sooo excited for driverless cars! http://t.co/TRZ3qx6OG6,5
52,Pumped to see some driverless cars today @ejdub. This is going to be great!,5
53,I want a driverless Robocar! Listening to @bradtem here at #ocediscovery! http://t.co/dz5nEL5lZ5,5
54,@ryanchris I drive hundreds of miles a week. Bring on the driverless car. CanÌ¢‰âÂ‰ã¢t wait to stop driving.,5
55,The future! So buying one of these. Ì¢‰âÂÒ@CNET: Audi is ready to test autonomous cars on public roads http://t.co/aZTbHLcy #CES #2013CESÌ¢‰âÂå,4
56,"Audi is test driving their driverless car in Tampa today, pretty cool.",4
57,autonomous car s quite a potential business case in markets like north america as speeds for every single road is defined. even on freeways!,4
58,Nissan to have an autonomous car by the year 2020. Sign me up!,4
59,Huge advances in autonomous cars. Ì¢‰âÂÒ@WSJ: Hate parking? Audi unveiled a self-driving car that can park itself: http://t.co/F2tZNsiy #CESÌ¢‰âÂå,4
60,RT Ì¢‰âÂÒ@TheEricFulton: Great article on #disabled transportation I will opt 4  @elonmusk 2 deliver my #autonomous car http://t.co/2hJxhTPsQ6Ì¢‰âÂå,4
61,Volvo's Awesome New Autonomous Self-Parking Car Is Its Own Valet http://t.co/UJqyzY2mvq,4
62,In less than five years I can use the Google autonomous car. I will get on the list now,4
63,I look forward to seeing Google's self-driving car and other autonomous vehicles driving around the District http://t.co/arUY22uW9i,4
64,Ì¢‰âÂÒTook a ride in a Google self-driving car. Lived to tell about it: http://t.co/96ROmPcv #Autonomous http://t.co/QMRtgjnEÌ¢‰âÂå @ericpwhall,4
65,Nissan debuts first-ever fly-by-wire automobile steering system. Your autonomous car is gonna love it. http://t.co/gL#amD4Gm,4
66,Whoa just peeped an autonomous google car,4
67,"Very cool video of how an autonomous car works. From ""Where To?"" Opening tomorrow @ComputerHistory #chmwhereto http://t.co/amTfkZlKBS",4
68,"Reuss says Google autonomous car looks kind of like VW and that it is ""kind of cool.""",4
69,Imagine a world w/o drunk driving deaths. RT @elidourado: Drunk riding in an autonomous car is safer than sober driving.,4
70,"The ""iCar"" isn't autonomous, but it's way way more fun to drive than a Google bubble car. http://t.co/q5g7zojAEC",4
71,Thx 2 @CarnegieMellon 4 bringing their #autonomous car 2 #Congress. This technology will literally drive the future. http://t.co/dZclAZWMh1,4
72,Autonomous Driving Advantage #14 - Your car can drive itself to the shop so you don't have to wait around in some smelly waiting room,4
73,"Showing video of google autonomous car -- it is very cool. 350,000 miles driven w/ no driver interaction across 10 vehicles.",4
74,"Google should buy Tesla and Uber, mix a little autonomous car into the mix and solve all transportation problems.  #sentFromTraffic",4
75,Fascinating presentation by Chris Urmson head of #Google #autonomous #car on the hill / @ Rayburn,3
76,Drivers would opt for autonomous driving for cheaper car insurance as well http://t.co/nOap06ilWZ,4
77,To put it in lay terms. An autonomous nuclear powered car just landed itself on Mars using a rocket crane! This is huge!,4
78,There's some great projects being worked on in our robotics lab like an autonomous car and lego builder. At WCCC we love a hands-on approach,4
79,"Last night I saw horse cops, makes me have hope for the car once silly autonomous vehicles take over the market http://t.co/craLBSS6oa",4
80,Am looking forward to the day when google and amazon drones fight it out to deliver my autonomous car,4
81,"Autonomus car will drive Miss Daisy, and me, I hope ~ Autonomous Vehicles Now Legal in California | Autopia | Wired http://t.co/Da2Qb87q",4
82,"Autonomous car? Yes, please. #innovation @CBSSunday",4
83,Sucks to be the luddites who have no appreciation for fine automobiles. Autonomous car technology is here like we've always dreamt.,4
84,Tesla CEO Musk Sees Fully Autonomous Car Ready in Five or Six Years via @YahooNewsDigest.,3
85,"GM's CEO isn't talking about this right now, but GM's autonomous car concept uses less weight and # energy: http://t.co/ZxN2QHDMyP #CERAWeek",4
86,"Yup. RT @justcoachit: Wow! Audi cars now park themselves-first automaker with an ""autonomous"" vehicle license in Nevada....",3
87,ITE Technical Conference - great Google's Autonomous Vehicle presentation,4
88,One solution to poor DC cab service: call your autonomous vehicle! http://t.co/pxhEkt5eh5,4
89,Cross fingers for google autonomous vehicle announcement. #GoogleIO,4
90,Behold the autonomous vehicle!  Being back at SU rocks! #singularityu #GSP12 #emergingtech http://t.co/KFsIuKQY,4
91,Look forward to speaking at the Florida Autonomous Vehicle Summit this Friday about innovation in transportation #sayfie,4
92,Packed house at #TRBAM! Thanks to my friends and all the autonomous vehicle enthusiasts for coming out. http://t.co/Wu77N79mB5,4
93,"Ì¢‰âÂÒ@TomBamonte: Description of the Navia, low-speed autonomous vehicle. @automotive_news http://t.co/Z3BJttY27MÌ¢‰âÂå Love to see 'em in FW someday",4
94,#Alert: Licence Plate Number of #Continental Autonomous Vehicle that took off with my boss!  Wow. http://t.co/hKDznnTEcg,4
95,"Given how ornery and rude this #megabus driver is, I'm looking forward to when he gets replaced by an autonomous vehicle #robot",4
96,"fascinating! ""@PopMech: what California's autonomous vehicle driving permit looks like: http://t.co/Fr5gckJ6L7 http://t.co/Tamb9xLVwM""",3
97,"Given how ornery and rude this @megabus driver is, I'm looking forward to when he gets replaced by an autonomous vehicle #robot SF-&gt;Sac",4
98,Someone drove the DARPA car over break. Why was I not invited?,4
99,Perfect!!! Ì¢‰âÂÒ@TheChriswhiz: @livehappy8 DARPA will sponsor a self-driving car! ;-)Ì¢‰âÂå,4
100,"OKAY  Ì¢‰âÂÒDriverless Cars: Safe, Reliable, No Vision Necessary http://t.co/59TcEvjc98 via @cogwburÌ¢‰âÂå",3
101,"@pavel In other news, (public) driverless cars could actually be great for the environment.",3
102,"Woot! Can't wait to try it... Uber purchases 2,500 driverless cars from Google: http://t.co/0fEtyFlWic",4
103,"Can't wait to try this...Ì¢‰âÂÒ@slashdot: Uber To Purchase 2,500 Driverless Cars From Google http://t.co/YfvV64qyJpÌ¢‰âÂå",4
104,"Uber To Purchase 2,500 Driverless Cars From Google http://t.co/GmAMmaPkRa (things are getting interesting!)",4
105,@johnbattelle I was faked out for a few minutes. I guess geeking out over how cool driverless cars would be clouded my BS gauge!,4
106,"""@WSJCorpIntel: Nissan says it will release a driverless car by 2020, and that's a good thing, because humans are terrible at driving",4
107,"Brilliant sci fi piece from TC - ""Uber To Purchase 2,500 Driverless Cars From Google http://t.co/m82KDShTQL by @ryanlawler""",4
108,I can't wait for the day when driverless cars make parking tickets and searching for parking spots things of the past.,4
109,I want a driverless car! #auvsi Ì¢‰âÂÒ@FDOT_Secretary: 3 States Investing in Smart Transportation   #cdw http://t.co/wVTgIAtclP via @StateTechÌ¢‰âÂå,4
110,@mchyser also the google driverless cars have a 0% accident rate to date,4
111,"I'm at the ""Hacking driverless vehicles"" talk. So good. #defcon",4
112,"@CTVBC yes to driverless bus, it'll be interesting.",4
113,Google hurry the fuck up with your driverless car!,4
114,Driverless cars. Chairs moved by brain function. Robots who can actively learn new things. Turn on the #Science channel NOW! #Amazing,4
115,"@Google Chief Legal Officer David Drummond on #driverless cars: Not far off, will have huge safety, urban planning benefits. @Liberationtech",4
116,Technology for driverless cars will make DriverÌ¢‰âÂ‰ã¢s Cars better too.,4
117,Get ready for the mother of all generation gaps. Driverless cars here we come.,4
118,We need driverless cars ASAP - check it out!  http://t.co/w753nQLdgG,3
119,A driverless car. You get in the passenger seat and it drive you. Wow. [pic]: http://t.co/U19YRdLu,4
120,"#2013CES was awesome-Ubuntu phone coming out soon,4K TVsÌ¢‰âÂå_meh,OLED yes, saw lots of innovation from smaller companies, driverless Lexus",4
121,"In Google's driverless-car world, a single lane of freeway could transport 35,000 vehicles / hour, up from 1,500 today http://t.co/EiI55nfa",3
122,i want a driverless car,5
123,Ì¢‰âÂÒ@MotherJones: .@kdrum: Driverless cars are going to change our lives. Soon. http://t.co/crUrswcYÌ¢‰âÂå,3
124,Ya can't stop the future; driving rel. fatalities fell in 2011 to the lowest since 1949.. incoming: Driverless Cars &amp; 90% cheaper insurence.,4
125,Mind. Blown. Ì¡üèÏå_Ì¡ü‰Ûªå´Ì¡ü‰Ûªå¬ Ì¢‰âÂÒ@Forbes: Fasten your seatbelts: Google's driverless car is worth trillions http://t.co/3S15jv3bÌ¢‰âÂå,4
126,Ì¢‰âÂÒ@WhatTheFFacts: A driverless car has completed over 300k miles &amp; only had 2 accidents when humans in other cars hit it.Ì¢‰âÂå Great for drunks Ì¡ü‰Û÷å,4
127,Oh the glamour. @ruskin147 filing for @BBCBreakfast tomorrow morning from the floor on driverless cars. http://t.co/M21oHTAb,4
128,Guess what we were driving next to on the I-80? A driverless car. Nice! (@ I-80) [pic]: http://t.co/9xbkLkw1,4
129,The beginning of a good series of articles: Fasten Your Seatbelts: Google's Driverless Car Is Worth Trillions - Forbes http://t.co/s7POPIgj,4
130,ItÌ¢‰âÂ‰ã¢s a thing! Ì¢‰âÂÒ@shannapreve: can't wait!  Fasten Your Seatbelts: Google's Driverless Car Is Worth Trillions - Forbes http://t.co/X78GQ2I2Ì¢‰âÂå,5
131,Fasten Your Seatbelts: Google's Driverless Car is worth trillions. http://t.co/ezk0gtER,4
132,"@Forbes: ""Fasten your seatbelts: Google's driverless car is worth trillions"" http://t.co/17SSUk0sÌ¢‰âÂå @Chunkamui I'll drive for a lot less",4
133,"So excited about today's @CarolinaNowTV. Hair, music and driverless cars. It's going to be a good one. #carolinanow",4
134,"With google (x) team.  Google glasses, driverless car and Loon (wifi thru high alt balloons). Fun!!! @Ì¢‰âÂå_ http://t.co/oEuiNRxDch",4
135,#VanWa Regional Transportation Council had interesting testimony about driverless cars. Fewer DUIs and no drivers licenses needed.,4
136,Whoa! Google driverless cabs to launch in NYC!  http://t.co/2Zx66kVdjY,4
137,The future is here thanks to @Google. // The driverless revolution rolls on -  http://t.co/QELyckMhWH,4
138,Great piece by @TomFontaineTrib  about @RepBillShuster excellent trip in driverless cadillac thru #Pittsburgh http://t.co/wAx4jAACpg,4
139,"Who hoo ""@GlobeTechnology: California to regulate driverless cars by the end of 2014 http://t.co/JiQps2BRzf #cdntech""",3
140,Driverless cars are in our future.#SXSW14 #sxsw #technology,4
141,"Dope RT @BBCWorld Swivel seats, big screen, espresso machine -  driverless car of the future http://t.co/n0jwPVN3Tt  http://t.co/PzhAGzQG5M",3
142,Checking out the @JaxBizJournal event #TransportationTomorrow: The Future Is Now: Driverless Vehicles #jaxevents @NorthFloridaTPO,4
143,"@mikesonn @printtemps I think that's short-sighted. In the long run, transit continues to grow. As that happens, driverless solves problems.",4
144,"I, for one, cannot wait for #driverless cars. Tired of people using their cars as lethal weapons @robotenomics",4
145,man i had this dream about a driverless car.  it was awesome.,4
146,I want a driverless car. Someone invent one,4
147,"DonÌ¢‰âÂ‰ã¢t make driverless cars, make the act of driving to work not required..",3
148,"""The idea is to challenge traditional automotive design."" The Geneva Auto Show + Tesla's very sexy driverless car &gt;&gt; http://t.co/HYOYLX297o",3
149,"Driverless cars could free up 20-80% of urban land. Uh, when can that happen in NYC? More room for cronuts, right @AllisonPR ? #SXSW",4
150,#SXSW favorites: Driverless cars could shape ways we design #cities. Optimization programs change day-to-day life. #Autonomous #govlabsxsw,4
151,Driverless cars should exist so speeding tickets don't,3
152,@levie can't wait to order groceries from Google Glass while riding in my driverless car.,4
153,"Driverless Cars; EyeGlasses; Internet Balloons...""Oh My"" Wonderful Wizards of Google are targeting 5B Unwired People http://t.co/C4wRWKPg8Q",4
154,"@bryanrwalsh driverless cars combined with #carsharing would drastically improve asset utilization, reducing traffic",4
155,For those wondering when the driver-less car may be available http://t.co/FKVe4lOLAZ Interesting interview,4
156,A driverless car invented by Google has completed over 300k miles and only had two accidents when humans in other cars hit it @sara_horne5,4
157,A driverless car invented by Google has completed over 300k miles and only had two accidents when humans in other cars hit it.Ì¢‰âÂå,4
158,Ì¢‰âÂÒ@uarenotworthy: i dont trust anyone's driving 100% i dont even trust my damn self that muchÌ¢‰âÂå you shouldn't we are the weak link #driverless,4
159,@starsandrobots @fbz problem there is there is still a driver. I want driverless transport. Humans are waste in the transport world.,4
160,"Think how much driving infrastructure won't be needed with driverless cars. Stop signs, for example -- cars can adjust so as never to stop.",4
161,Google: Driverless cars are mastering city streets (from @AP) http://t.co/pgBfYS2OhL,4
162,@ntxjeran: @Varneyco Re driverless cars...we fly/land thousands of miles in airplanes on auto pilot. Why not cars?,4
163,@Varneyco Re driverless cars...we fly/land thousands in airplanes on auto pilot. Why not cars?,4
164,"Driverless cars are mastering city streets, Google says: Google says that cars it has programmed to drive... http://t.co/bc2K0J4UHw",4
165,The #future of #transportation in our own backyard! http://t.co/BgnvIsA5Ch @joey_flatt @tdoveyfishman #driverless #Google #selfdriving,4
166,How cool would a transparent car be. I'd rather have a driverless car. #driverlesscar,4
167,"ÌÄÒber courier launch was bound to happen. Again, I can't wait till @GoogleVentures hooks them up with driverless cars #scifilyfe",4
168,Google: Driverless cars are mastering city streets (from @AP) the future is upon us #tvp http://t.co/cwMndDKicl,4
169,Google: Driverless cars are mastering city streets http://t.co/Lr1Xa9B9fw,4
170,Google: Driverless cars are mastering city streets  http://t.co/AerMDvYZu5,4
171,Google says its driverless cars are mastering city streets: Google says it has turned a corner in its pursuit of... http://t.co/RlTDGhN3wA,3
172,Ì¢‰âÂÒ@driverlesstrans: #Driverless cars canÌ¢‰âÂ‰ã¢t come soon enough   http://t.co/3qvoV9wtCc - @WashingtonPost http://t.co/YYBZtq41PPÌ¢‰âÂå 100% true,4
173,@DoKaLife / I hope the driverless cars get here pretty soon. My eyesight is getting pretty bad.,4
174,@sampullara aggressive drivers bully conservative (human) ones and it's nbd. also: coordinated driverless cars could box up offenders :),4
175,Google: Driverless cars are mastering city streets http://t.co/npSCNvcni6,4
176,Very cool update from @google on performance of driverless cars - well worth watching 2 minute video as well: http://t.co/kOuQ9zQ1j2,4
177,Ì¢‰âÂÒ@DRUDGE_REPORT: GOOGLE:  Driverless cars master city streets... http://t.co/NvVbp9HZKMÌ¢‰âÂå has to be an upgrade from the morons on hwy 45,4
178,Driverless cars will be equipped with an emergency first response system. #HealthTech,4
179,"@alanjosephwilli urban sprawl could decrease with driverless cars, given that the required reaction time/space between cars decreases.",4
180,.@OReillySolid A3 Best thing would be if it's not my car--I'd like a flawlessly-dispatched driverless car share! #IoTChat,4
181,Imagine this... Uber+Waze+Google Driver-less cars! = a robot thats takes you home the fastest way possible! #wishfulthinking #techdreams,4
182,Google: Driverless cars are mastering city streets: Google says that cars it has programmed to drive themselves... http://t.co/ERZXNBKAAn,4
183,"""Google says its driverless cars starting to master city streets"" per the AP.  Wish they'd hurry so they could drive me around.",4
184,Google: Driverless cars are mastering city street: Google says that cars it has programmed to drive themselves... http://t.co/KRPU9H32xB,4
185,Google: Driverless cars are mastering city streets http://t.co/j8EUMi6aMQ (from @AP) The future is now.,4
186,@grahamharbison if fewer injuries and deaths occur I'm all for driverless cars.,4
187,I cant believe we have driverless cars....cool and scary at the same time,4
188,@ILMagazine #Trucking should be concerned about how quickly google's driverless car technology will be legal in OTR. Game changer.,4
189,@KajonKCRW Good idea for the next ten years as we transition to driverless cars....,3
190,@BarrettLyon driverless taxis could be interesting.,4
191,Google has a driverless car prototype. You know what that means? That sucker who always has to be the DD gets to have fun too.,4
192,"So now that Google has made the driverless car ill no longer be mad I can't find parking... Me ""car, drive around the block til I return""",3
193,"California, Florida and Nevada have all legalized driverless cars. Acceptance is spreading! http://t.co/OV8ij1NG",4
194,Am I late to the party realizing googleÌ¢‰âÂ‰ã¢s Waze purchase is quite intriguing when you consider their driverless cars?,4
195,Google is releasing a driverless car. This would solve all my problems and save my friends from being my permanent chauffeurs,4
196,"@HRH_hjoseph @pmarca If we have driverless cars, it may eliminate the need for trains or busses.",4
197,"""@CNBC: Google's driverless car is good news for bad drivers: http://t.co/A1dOKEdGdE $GOOG http://t.co/XlwSWy5Mnf"" cool!  A car just for me",4
198,"First question to google wife: Does it have a stereo? I mean driverless is super cool etc, but you need some sounds http://t.co/b1aPtcEEvC",3
199,The concept of Uber + driverless cars is ridiculous and awesome.,3
200,"As far as I'm concerned, Google can be as evil as they want if they make the driverless car a reality. http://t.co/HRRigw1YRz",4
201,@jowyang @QuincyDJones and I need one of these driverless cars ! cc@TechCrunch,5
202,Driverless cars cool but there needs to be a manual control option for unpredictable circumstances,4
203,Driverless Cars could be an enormous ecological and economical benefit to society #technology http://t.co/1Y3hFNmNpJ,4
204,"@jeffrohoward The whole scene with Jared in the driverless car had me dying, it's such a perfect role for him comin from The Office",4
205,"Test-driving Google's driverless car: Look, Mom, no hands: Google's robotic cars have about $150,000 in equipment... http://t.co/QTDC5IQy4t",4
206,@MarkHatch pointed me at this blog series on the impact of GoogleÌ¢‰âÂ‰ã¢s driverless car. Fascinating! http://t.co/YpsolFBw9U,4
207,The best thing  I read in along time on driverless cars and mobility  http://t.co/LRg2mYdFk1,4
208,The advent of driverless cars presents a compelling #bigdata #predictive software opportunity,4
209,"@antichrista @SebOrSam Focusing on mass transit is grand, but driverless cars will play a tremendous supporting role in mass adoption.",4
210,Ì¢‰âÂÒ@nytimes: Disruptions: How Driverless Cars Could Reshape Cities http://t.co/cvonWrkxSDÌ¢‰âÂå&lt;&lt; I've seen some of those cars on the 101! CRAZY,3
