id,text,sentiment_SVM_5
426,"We need a clean camera because today, the camera is (essentially) in control of the vehicle using Autonomous Rendezvous and Capture tech!",3
427,autonomous vehicle assurance internship http://t.co/kS6dD1tl via http://t.co/PpYu44Cw,3
428,Radar cruise control is basically a 50% autonomous vehicle. It does braking and acceleration to a maximum speed. You just steer (for now).,3
429,Does it require extra insurance? RT @michigannews: Autonomous vehicle testing now allowed under Michigan law http://t.co/1x8fAPjFUg,3
430,"""@WiredAutopia: Michigan Governor Approves Autonomous Vehicle Testing http://t.co/LFdfWSdkip""",3
431,Michigan gives green light to autonomous vehicle testing despite concerns from Google: Michigan will soon become... http://t.co/PFPo5h7uxh,3
432,Auto psychedelia: Lidar heat map from #Ford Fusion Hybrid Autonomous Research Vehicle http://t.co/AqOkQ3DsPR,3
433,Michigan latest state to approve autonomous vehicle testing? For more details: http://t.co/UvruMVJ5gZ,3
434,Michigan gives green light to autonomous vehicle testing despite concerns from Google: Michigan will soon become... http://t.co/4zstgYqjJn,3
435,Ford shows off its new autonomous driving research vehicle Ì¢‰âÂ‰ÛÏ itÌ¢‰âÂ‰ã¢s got lasers http://t.co/EedDkjAIMO,3
436,Autonomous Surface Vehicle automates engineeringÌ¢‰âÂ‰ã¢s dirtiest jobs http://t.co/QuBHED3QH9,3
437,"Driving in 280 traffic last night I fought the urge to cut off a Google autonomous vehicle. Just to help with their testing, of course.",3
438,"""@google: Tune in at 1pm PT: CA Gov. Brown signs autonomous vehicle bill http://t.co/PNW2u2nP""",3
439,"30 years ago Knight Rider premiered, and the autonomous vehicle of the future was a Trans Am. Now it's a Prius.",3
440,If my autonomous vehicle has a drivers license without a photo... which states can it vote in? #autonomousVehicleProblems,3
441,Governor Snyder announced the signing of the autonomous vehicle bill at the denso booth. http://t.co/chzKy0FGWX,3
442,BYD and Singapore Institute collaborate on autonomous electric vehicle tech for mass transportation - http://t.co/Sz9km6ttYZ,3
443,@uptownmaker @sparkfun any date for Autonomous Vehicle Challenge 2014?,3
444,autonomous road vehicle (ARVs)  http://t.co/CcjL6xs57z,3
445,The start to building an #autonomous RC vehicle has begun. Brought a #RaspberryPi and a monster truck RC vehicle. Let #science be DONE!!!,3
446,Day 2 of National Association of Motor Vehicle Boards/Commissions. Full agenda...looking forward to hearing about autonomous vehicle regs.,3
447,Can we install cameras to study Michigan football too plz? MT @NathanBomey MI will install cameras in freeways for autonomous vehicle study,3
448,"State, GM, Ford and U-M team up to promote autonomous vehicle research: Southeast Michigan will lead the nation... http://t.co/iMhfsmGkOU",3
449,Verizon CEO: Autonomous Vehicle Could Happen In 3-5 Years: By Edward CardenasDETROIT (CBS Detroit) Ì¢‰âÂ‰ÛÏ The CEO of... http://t.co/utkPVlNliT,3
450,#cpcu14 #PLIG  @BernardSoriano Tomorrow Today: Bernard Soriano is on stage now. CA is the leader in autonomous vehicle laws,3
451,Hardware for autonomous driving vehicle now is size of iPad vs filling a trunk  -- @audi #CMO #nymarketing,3
452,"If there are going to be automated cars out on the road, I want them to come from DARPA, not google",4
453,Self driving cars began with DARPA in 2004. #yptbwp,3
454,"For you, @henryoddi Ì¢‰âÂÒ@TransportNation: Carnegie Mellon shows off its own driver-less car. http://t.co/WfSiq1jigj""",3
455,"GM Says Almost-Driverless Cars Coming By 2020: MILFORD (AP) - Sometime before the end of this decade, General... http://t.co/zFza7ybBo1",3
456,Ì¢‰âÂÒNissan Plans to Offer Driverless Cars by 2020 http://t.co/8DYKNAX14VÌ¢‰âÂå,3
457,"GM says almost-driverless cars coming by 2020: MILFORD, Mich. Ì¢‰âÂ‰Û Sometime before the end of this decade, General... http://t.co/iLw0aeSoxH",3
458,General Motors promises nearly driverless cars by end of decade with 'Super Cruise' system: Sometime before the... http://t.co/nyV2XCzpij,3
459,"Ì¢‰âÂÒ@techreview: Are Driverless Cars Really Just Around the Corner? http://t.co/ceOTHNcNK5Ì¢‰âÂå &lt; Yes, and with headlights off, ready to pounce",3
460,"Robo-cabs! Ì¢‰âÂÒ@thegooglecar: #googlecar Uber Returns the Favor, Buys 2500 Google Driverless Cars - RedOrbit http://t.co/aDqhnblIqU #TechNewsÌ¢‰âÂå",3
461,Nissan Plans to Offer Driverless Cars by 2020 http://t.co/wllhWhQsPU,3
462,I need plan b. Outlook for cdl drivers not good thanks to Google's driverless tech. I wonder if that can handle hazmat? And FED regulations?,3
463,"Ì¢‰âÂÒ@ChrisHulls: Uber To Purchase 2,500 Driverless Cars From Google | TechCrunch http://t.co/ScKaMgz9QaÌ¢‰âÂå Great Service/App",3
464,Uber to purchase 2500 driverless cars from Google in the future. Great investment @GoogleVentures.,3
465,@mchyser I assume the driverless cars will be able to sense other traffic through radar/sonar/etc &amp; adjust accordingly (prob faster than us),3
466,Ì¢‰âÂÒ@TucsonNewsNow: Students to test driverless car http://t.co/Z5FZPw3GVOÌ¢‰âÂå @UofA  #Tucson,3
467,There is a race 2 b first state with driverless vehicles for economic competitive edge and jobs. #ITE2013AM,3
468,"Uber To Purchase 2,500 Driverless Cars FromÌâåÊGoogle http://t.co/V9xYZQhAwj",3
469,Dispatch from the future: Uber and driverless cars http://t.co/2p51Iypt3k via @natebessa,3
470,"As a motorcyclist and technologist, IÌ¢‰âÂ‰ã¢d like to volunteer my services for testing how driverless cars deal with being trolled by motorcycles",3
471,"Oh hai #minorityreport, @Uber is making your driverless transportation come alive...#transportation #autonomous http://t.co/p3gzq2ttFB",3
472,Oh hai #minorityreport @Uber is making your driverless transportation come to life... #future #transportation http://t.co/p3gzq2ttFB,3
473,"Dispatch From The Future: Uber To Purchase 2,500 Driverless Cars FromÌâåÊGoogle http://t.co/OmwDcNKBAB by @ryanlawler",3
474,"RT @mikojava: As Google Ventures Invests $250 Million In Uber, What's Next? Driverless Cars On Demand?  http://t.co/a0ed8pVNEI via @forbes",3
475,TV show plot idea: big insurance exec tries to kill driverless car industry by destroying safety record using giant picture of empty road,3
476,Driverless Google cars for Uber can we actually make this happen? ItÌ¢‰âÂ‰ã¢s 2013 and I want my flying car as well! #Jetsons,3
477,If @uber wants to use driverless cars that's fine. I still want to be able to rate the driver and have the bad ones fired.,3
478,@al3x or driverless car ? just have it stocked with best sellers and respond to sales via twitter or txt ?,3
479,First Drive Q50 feels driverless http://usat.lie/16bZCRH @USAtoday @ChrisWoodyard @InfinitiUSA #DriveOn #tech #HighTech #Cars #Autos,3
480,GM says almost-driverless cars coming by 2020 http://t.co/5SZmYA8Dm3 :-),3
481,"last time I rode in an Uber cab the door handles were filled w/candy #humantouch ""Uber To buy 2,500 Driverless Cars http://t.co/L7T1XqoBny""",3
482,"Proposed effects of driverless car on all things auto--infrastructure, funding, policy-- is one of most interesting discussions right now",3
483,"""@theprovince: General Motors promises nearly driverless cars by end of decade with 'Super Cruise' system http://t.co/VY8anMcZvl"" Zetson,s",3
484,GM says almost-driverless cars coming by 2020: General Motors says that before the end of this decade it will... http://t.co/69l3UCrsuK,3
485,Why a driverless car? @Nissan,1
486,Thinking about Google's driverless tech and I wish I could have a bear hug...,3
487,@StKonrath @Which50 perhaps a future of driverless google taxis is in order for Uber?,3
488,Google is going to build its own driverless cars http://t.co/ICyvTJyOGF via @ForbesTech,3
489,Google's driverless car + @Uber = future?,3
490,"@nilanp I thought the same thing actually - that there must be some strategic motive as well (e.g., driverless cars + @Uber = ?!). We'll see",3
491,"RT @slashdot: Uber To Purchase 2,500 Driverless Cars From Google http://t.co/rjfkWuM9y8 &lt;- Did GOOG just out 2500 cabbies out of work?",3
492,"@Uber is going to buy 2,500 driverless cars from @Google, proving everything Taxi Drivers have been saying about this disruptive app company",3
493,I guess we're going to be uber'd around in driverless cars here in SF in the not-too-distant. http://t.co/isnsh7q6WO #uber #Google,3
494,[NEW BLOG] the driverless taxi is just the beginning - http://t.co/Gefk4z35WG,3
495,He'll carry it but he won't hit it. RT @Texashacker34 @AshleyKMayo somehow I doubt he goes driverless.,3
496,@WalkableDFW Curious how you feel about driverless cars and the impact they'll have on cities and development.,3
497,Schmidt says Google's gigabit Internet in Kansas City is more important than its driverless cars. #dbconf,3
498,"Forget driverless cars, I'm excited to hear that Google is working on the immortality opportunity. Welcome, Ray!",3
499,"Eric Schmidt of Google ""takes 20 mn for human in driverless car to stop freaking out""",3
500,Saw my first Google driverless car today. Not sure why the driver has her hands on the wheel though #google http://t.co/S6hqvKAt,3
501,@JustinMRaymond there will be a day that I hail a driverless car. It's name will be @HailoToronto,3
502,Is it against the law to text and drive in a driverless car @WIRED ?,3
503,Interesting exploration of how driverless cars might make tough ethical decisions in a crisis: http://t.co/1StjpBFjtP via @nicolasnova,3
504,Larry Burns: driverless and connected vehicles can co-exist. Need fuel cells and batteries.,3
505,Driverless cars will liberate humanity by finally allowing the shift from Sing Occupancy Vehicles to Zero Occupancy Vehicles.,3
506,"type faster @portemantho Ì¢‰âÂÒ@emilychangtv: ""We're not more than a few years from driverless Teslas"" -- Elon Musk on @BloombergWestÌ¢‰âÂå",3
507,Ì¢‰âÂÒ@driverlesstrans: Tampa Bay TImes: Bottom line with #Driverless cars: Will people buy them? @susan_thurston   http://t.co/WRvJGylombÌ¢‰âÂå me!,3
508,#driverless cars are exciting but what to insure? Who to insure? We need system-wide reimagination of risks.. http://t.co/tqpI5CHrgj,3
509,"""@ropomobile: Why the U.S. government wants cars to talk to each other: http://t.co/6995puC6d7 http://t.co/s8cncNPlpI via @WSJ"" #Driverless",3
510,Drive my car! Driverless cars could be a game changer for insurance costs @beckyyerak @bmoller  http://t.co/RKuWUhP1sw,3
511,Volvo is also making a #driverless car. Prototype NHTSA Level 3. http://t.co/JnKjwxcKMV @volvocarsglobal,3
512,Driverless Car Technology. http://t.co/cYPT7CnsSq,3
513,#Sensors in Driverless Cars http://t.co/3kd2n2lK63 #IoE #IoT #WSN #Tech #IntelligentTire @BMW @BMWUSA @BMWi @MEMSGroup @EHJournal @IDTechEx,3
514,@zain90909 @drvrls I agree but it seems to me that much work needs to be done to our infrastructure before driverless cars are the norm.,3
515,Could #AnnArbor be the hub of wireless and driverless cars? @SEMStartup explores the future of cars and #Michigan http://t.co/fd1GaTFJ6e,3
516,"I predict Google will buy Uber and create driverless transit with little self-serve bars and resurrect the ""Automat.""",3
517,Rumor is that the E.U. agreed to CityMobil2 #driverless car public demonstration projects in several cities. http://t.co/QewjJIEDZ2,3
518,Check out the google driverless car! http://t.co/VSPeZ5n47u,3
519,Ì¢‰âÂÒ@MotherJones: Chart of the Day: Driverless Cars Are Coming! http://t.co/1P59f2olRcÌ¢‰âÂå YES!!,3
520,@SebastianThrun talking about driverless cars and #moocs #ccideas http://t.co/NZgO3PCZIg,3
521,Ì¢‰âÂÒ@Inc1alex: #BMWBobsled : Why driverless cars are better drivers than humans. Do you agree? http://t.co/w753nQLdgGÌ¢‰âÂå AGREE!!,3
522,Just thinkin' O and his people will be first to buy the driverless car. #tcot,3
523,interesting discussion on driverless car Ì¢‰âÂÒ@robotenomics: Your questions answered: driverless cars - http://t.co/ExfytJVlIw #GoogleAlertsÌ¢‰âÂå,3
524,@iowahawkblog @ConserAnimal   can anyone think of a metaphor for the driverless car?!,3
525,@TrooperBen Who gets the ticket if I crash into one of those driverless cars? Oomph,3
526,@toyota when is toyota going to make a driverless car?,3
527,Auburn Hills supplier's driverless car set to hit Nevada roads: Continental of Auburn Hills today became the first... http://t.co/7hs0LEBf,3
528,"No driverless cars in #yeg yet. We've removed winter driving skills, situational awareness, and patience Ì¢‰âÂå_ just not the actual driver.",3
529,@matjnewton Feel free to email me your thoughts on driverless cars. I may do a followup article. My email is in my Twitter bio. Cheers!,3
530,Ì¢‰âÂèÏConnected-vehicle technologyÌ¢‰âÂ‰ã¢ could cut crashes while paving way for driverless cars http://t.co/sAms2HjMCS,3
531,The computer that drives a robotic driverless car. http://t.co/bl0skRVOMQ,3
532,What's up with Taxi / Uber drivers facebooking while driving. It was bad enough they can't drive without GPS. The driverless car is here.,3
533,Driver-less cars? Come on Michigan!,3
534,@LazyAhab how about software updates for connected cars -- hackers -- driverless vehicles we can send on errands. So much good/bad potential,3
535,Broad layer. Driverless car to SaaS @micahjay1 ecommerce is cold now. Need to see the product. Deck is not enough. For seed round.,3
536,Ì¢‰âÂÒ@AMobilityP: Larry Burns @UMEngineering we will be replacing cars w/shared driverless vehicles. #bcv2014Ì¢‰âÂå that's the Upshift vision too!,3
537,@Dezeen: Driverless cars designed for use as mobile offices: http://t.co/WaChy4Q7l6 #design #technology http://t.co/IZielJcbnt @transitbear,3
538,"It was born out of the discussion about driverless cars and the crazy differential equations involved in tracking road conditions, obviously",3
539,@TreeHugger well as long as they are in Google driver-less cars,3
540,News I wrote; Technology memo: The advent of driverless cars is here amid challenges.,3
541,"@jwisser @jakepolo What, with the driverless cars? ThatÌ¢‰âÂ‰ã¢ll be a standard Tesla feature within a decade.",3
542,"Bad programmer, no donut for you. Ì¢‰âÂÒ@slashdot: How Do You Give a Ticket To a Driverless Car? http://t.co/9xjMitdqÌ¢‰âÂå",3
543,RT @WeirdReport: CA cancels driverless cars on state hwys as the cars were driving to TX and TN in search of a better life.,3
544,Fasten Your Seatbelts: GoogleÌ¢‰âÂ‰ã¢s Driverless Car Is Worth Trillions  http://t.co/vUJ7eya8,4
545,@Cps235 around in a driverless car?,1
546,"New positioning tech works indoors, and underground. Think of what it could do for robotics and driverless cars http://t.co/izww1NYt",3
547,This analyst just told us that the manufacturers think that driverless cars will be commercially viable before Eliza can drive. #2013CES,3
548,Where can we find technical information about Google Driverless Car?,3
549,"The story headline today is Lexus previews a driverless car at the CES.  Funny, I see cars all the time apparently without a driver.",3
550,Driverless car http://t.co/WCVlVDHr,1
551,"CES: Audi shows driverless car will also pick you up: We've heard of cars that drive themselves, but what about a... http://t.co/lPHlcanx",3
552,Driverless cars. In our lifetime. #CES2013 @ CES2013 http://t.co/5Dey33ky,3
553,@JimSpohrer tells a gr8 story on cab drivers askd abt driverless cars.,3
554,"Interesting! ""@WSJ: Who is to blame if a driverless car gets into a wreck? The legal implications of self-driving cars: http://t.co/tnS9Hg6D",3
555,Ì¢‰âÂÒ Simultaneously amazing and terrifying: @Audi's new driverless parking system demonstrated [video] http://t.co/VY7Q37AJÌ¢‰âÂå @meghandurst,3
556,Ì¢‰âÂÒ@Blakei: Simultaneously amazing and terrifying: @Audi's new driverless parking system demonstrated [video] http://t.co/zDSleSvuÌ¢‰âÂå,3
557,"@victorjfaust driverless car, drunk passenger, who gets ticket for running red light?",3
558,@AdrianInterns Google already created a driverless car that is legal in Cali and Nevada... i think they may be in junction with Toyota tho,3
559,@rocketman528 ...and driverless cars!,2
560,Google Streetview car! Or it might be one of those driver less ones? http://t.co/AfixEi0f,3
561,@google's driverless car has more implications than just odd stares MT @Forbes Google driverless car is worth trillions http://t.co/s3IdjwWk,3
562,Reading - Driverless Cars Will Change Our Lives. Soon. (Kevin Drum) http://t.co/FVREtJQn,3
563,Ì¢‰âÂÒ@jimlevan: Like Internet &amp; Mobile: Why GoogleÌ¢‰âÂ‰ã¢s driverless car is worth trillions http://t.co/BxMYwtJtÌ¢‰âÂå &lt; So are SAN-less DCs!,3
564,Prediction of the Day: Cities Will Soon Compete to Build Driverless Car Infrastructure. http://t.co/slp3Kg4f by @henrygrabar,3
565,@bcliffordearly needed to be listening to get that one:) driverless carssss,3
566,"Toyota, Audi Show Off Driverless-Car Tech at #2013CES http://t.co/CI1aXYzy",3
567,Is this going to be the reaction to driverless cars? http://t.co/vzIOSoMr!,3
568,Ì¢‰âÂÒSAI: Watch These McDonald's Employees Freak Out When A 'Driverless' Car Rolls Up by http://t.co/4GuyObj7Ì¢‰âÂå it's quiet funny,3
569,Ì¢‰âÂÒ@SAI: Watch These McDonalds Employees Freak Out When A 'Driverless' Car Rolls Up by @meganrosedickey http://t.co/zobqcBsFÌ¢‰âÂå E: gotta love it,3
570,Ì¢‰âÂÒ@HannahElliott: Audi is the first automaker allowed to put driverless cars on the road http://t.co/Y8wT8PYqÌ¢‰âÂå,3
571,Ohio State Researchers Working On Car That Will Drive Itself: The idea of a driverless car is closer than you think.... http://t.co/6kBmf7Dq,3
572,How long until it becomes prohibitively expensive to insure a non-driverless car?,3
573,Bet I cop one of then driverless cars!,2
574,"In Google's driverless car world, a single lane of freeway could transport 35,000 vehicles / hour, up from 1,500 today http://t.co/EiI55nfa",3
575,@SeinfeldToday Kramer enlists Jackie to sue Google for stealing his idea for a driverless car. George impersonates Jerry for a Reddit AMA.,3
576,@Google driverless car. Dodging tires and taking names #badass http://t.co/jf1i6c6j,3
577,"Driverless cars will be mass market-ready by 2020-2025, CEA says. Gartner says it'll begin happening sooner. #CES",3
578,What do u think of when you think of the future? Global warming? Smart houses? Driverless cars? How might u design it? http://t.co/xPkX8jBY,3
579,"@andrewfnewman Oh... Driverless != human driverless? Bah, pedantry!",3
580,RT @MotherJones .@kdrum: Driverless cars are going to change our lives. Soon. http://t.co/Bpw1QhyU | @MANOMACHINE,3
581,"@introspection True, I suppose. It's nice to see my ""crazy"" decades long ideas become real. And heart-breaking.....driverless car.",3
582,"@damfino11 If a driverless car is in an accident, who will the ambulance chasing attorney sue? Google cars must be self-insured.",3
583,Ì¢‰âÂÒ@Forbes: Google's trillion-dollar driverless car will be commercialized sooner than you think http://t.co/nqy5dE5TÌ¢‰âÂå,3
584,Google's trillion-dollar driverless car will be commercialized sooner than you think http://t.co/Iwb4Shib via @Forbes #Innovation,3
585,Driverless Cars worth Trillions. With a T. http://t.co/129e9lVK,3
586,Forbes: Fasten Your Seatbelts: Google's Driverless Car Is Worth Trillions. http://t.co/V86l9ISF,3
587,Ì¢‰âÂÒ@Forbes: Popular on Forbes: Fasten your seatbelts: Google's driverless car is worth trillions http://t.co/iu0yT2laÌ¢‰âÂå,3
588,"Our week on the web: artificial islands, driverless cars on public ways, and an arsenal against flu and cold season. http://t.co/G50iltH4",3
589,"Toyota, Audi join Google on driverless highway: It looks like Google will have some competition on driverless cars,... http://t.co/LEoBbMYJ",3
590,Google is not a driverless car under Larry Page: When Google CEO Larry Page wanted to impress global advertising... http://t.co/0Lr57JpG,3
591,"CNN said CA, FL, and NV have already legalized driverless cars and by 2040 70% of all cars in US will be driverless #technology #amazing",3
592,"Audi unveils driverless car at Las Vegas tech show: Hot on the heels of Google, which began testing an auto-piloted... http://t.co/ETksL5Nm",3
593,"CES: Audi shows driverless car will also pick you up: We've heard of cars that drive themselves, but what about a... http://t.co/tnlaej4B",3
594,The 3-trillion driverless car has arrivedÌ¢‰âÂå_. what!?,3
595,"@googlestudents I'm writing my thesis paper on the driverless car, &amp; was wondering if you know of any good resources that cover this topic?",3
596,If google invents the driverless cars who will invent the carless drivers?,3
597,Who will build the emotion chip for the driverless cars,3
598,If google invents the driverless cars who will invent the careless drivers?,3
599,An intriguing article from @BloombergNews pointing out what could put the cork in #driverless cars. #transportation http://t.co/JO8r61xAGU,3
600,I want to avoid living in the suburbs until these suckers are ready Ì¢‰âÂÒ@EconBizFin: Driverless cars: A new Leaf http://t.co/kvInrlpwDAÌ¢‰âÂå,3
601,How Our Driverless Future Will Transform The Economy http://t.co/kxJl2Zd75c,3
602,Ì¢‰âÂÒ@HowardWBailey: How Our Driverless Future Will Transform the Economy http://t.co/T2DFfy2sAm via @DashBurstÌ¢‰âÂå,3
603,What if in order to have a #driverless vehicle you had to have a certain light indicator on the back and front of the vehicle. Maybe purple?,3
604,"MT Ì¢‰âÂÒ@NeilCombee: Google Considers Buying 250,000 Driverless Cars From Tesla, But Buys Tesla Instead  http://t.co/8KO6iFihA5 #sayfie",3
605,"@pfreet I suspect my first driverless car will be built in Fremont, not DetroitÌ¢‰âÂå_",3
606,"Google search turns 15, gets a makeover: With Google Glass, a new quest to cure death and driverless cars, it can... http://t.co/7RQ7tFNSl5",3
607,Driverless Cars for the Road Ahead-How do you feel about this? http://t.co/mgIHhEAgPg,3
608,"Google search turns 15, gets a makeover: (CNN) Ì¢‰âÂ‰Û With Google Glass, a new quest to cure death and driverless... http://t.co/bLk0McIcac",3
609,Google Signs Agreement with NYC Mayor to Replace NYC Taxis With Driverless Google Cabs http://t.co/5vWqUlie8z,3
610,"Google search turns 15, gets a makeover: (CNN) Ì¢‰âÂ‰Û With Google Glass, a new quest to cure death and driverless... http://t.co/UTYAYyjOXm",3
611,@Vertafore Today's Future of #Insurance Tech webinar brings up a good point: driverless cars will soon disrupt the #auto insurance industry.,3
612,@gruffuddarts @DIBanking @jimmy_wales Jimmy's spot on: Nissan Plans to Offer Driverless Cars by 2020 http://t.co/GHLzR3Q0Io,3
613,"@mholl7925 driverless cars are coming so get ask your driving in now, that is what I am doing.",5
614,Driverless Cars - Foresight to Concept at General Motors- talk at UC Berkeley by @IFTF friend &amp; client Rick Holman  https://t.co/3106s1Y7VI,3
615,I heard on the radio Google might be developing a driverless car. #whatyearisit,3
616,Pa. congressman to test driverless CMU car: PITTSBURGH (AP) - A Pennsylvania congressman is planning a trip to... http://t.co/JPyUwK023u,3
617,Is Canada ready for self-driving cars?: A transportation advocate says driverless cars could be ready for... http://t.co/dowaSiCMtf,3
618,Is Canada ready for self-driving cars?: A transportation advocate says driverless cars could be ready for... http://t.co/c1i81hol6U,3
619,Self-driving cars could be on CanadaÌ¢‰âÂ‰ã¢s roads in 4 years: expert: A transportation advocate says driverless cars... http://t.co/FBHGDhRdKv,3
620,Google's driverless car toured our campus yesterday. That's legit haha.,3
621,"@googleresearch I'm writing my thesis paper on the driverless car, &amp; was wondering if you know of any resources that cover this topic?",3
622,"@GoogleAuto I'm writing my thesis paper on the driverless car, and was wondering if you know of any quality resources that cover this topic?",3
623,Driverless cars for the road ahead https://t.co/rWTpVe0wVS WSJ's @Danneilwsj @CJRomig @tbondy @wmedved @jbbs @imacsweb @marshalltalks,3
624,Ì¢‰âÂÒ@DRUDGE_REPORT: Driverless Cars for Road Ahead... http://t.co/TizkrlwXkkÌ¢‰âÂå @ImSpentSir,3
625,@davidreynoldsx @blatherskyte I'm sympathetic. I thought NYC cabs were going to be replaced by Google driverless cars. #ThanksOnion,3
626,"With autonomous tech, like driverless vehicles, will we need to program ethics? What is the variance of danger/moral code? #GovGamble #SXSW",3
627,Could we program the ethics of driverless cars? I want to program my #driverlesscar to go a little faster than the speed limit. #Autonomous,3
628,Do we have the infrastructure for driverless cars to talk to each other? Is the current trend haphazard?#Autonomous #govlabsxsw #sxsw,3
629,Driverless cars could shape get way we design cities and communities. Optimization programs changing day-to-day life. #Autonomous #sxsw,3
630,Roadshow: Driverless cars will alert motorists to missing lane markings: Drivers must be in position to assume... http://t.co/jOR3S1m32M,3
631,"""Data, driverless cars and the future of the insurance business"" http://t.co/sP1JFMH7OR",3
632,"DMV Mulls How To Regulate Driverless Cars: LOS ANGELES (AP) Ì¢‰âÂ‰Û Sooner or later, consumers will be able to buy cars... http://t.co/ae2S0a0zsw",3
633,Ì¢‰âÂÒ@myfoxla: California pushes to finish driverless car rules http://t.co/MiBlMQJVHWÌ¢‰âÂå NO. Ì¡üèÏåÁ,3
